city,hotel_names,stars,rating,price,hotel_lat,hotel_lon,adresses,descriptions,link
Besancon,Brit Hotel Besancon l'Horloge,3,7.5,325,47.26358654,6.05153292,"1 Route de Marchaux, 25000 Besançon, France","Set in Besançon, 2 miles from Besancon Viotte Train Station, Brit Hotel Besancon l'Horloge offers accommodation with a shared lounge, free private parking, a terrace and a bar. With free WiFi, this 3-star hotel offers room service. The property is non-smoking and is situated 2.2 miles from Besançon-Mouillère train station.",https://www.booking.com/hotel/fr/kyriad-besancon-palente.en-gb.html?aid=304142&label=gen173nr-1FCAEoggI46AdIM1gEaE2IAQGYAQm4AQrIAQXYAQHoAQH4AQOIAgGoAgO4AsnCy6IGwAIB0gIkZjdhN2UwNzAtMDk0NC00MWE4LWI3MjQtZjYzZDAzMWYyMzAz2AIG4AIB&ucfs=1&arphpl=1&checkin=2023-05-04&checkout=2023-05-08&group_adults=2&req_adults=2&no_rooms=1&group_children=0&req_children=0&hpos=20&hapos=20&sr_order=popularity&srpvid=8a309eae8d9900c4&srepoch=1683153246&all_sr_blocks=17624008_363834517_2_2_0&highlighted_blocks=17624008_363834517_2_2_0&matching_block_id=17624008_363834517_2_2_0&sr_pri_blocks=17624008_363834517_2_2_0__32470&from=searchresults#hotelTmpl
Besancon,B&B HOTEL Besancon,2,7.5,265,47.22018011,5.95533135,"159 Rue de Dole, 25000 Besançon, France",Each room at this hotel is air conditioned and is equipped with a flat-screen TV. Cable channels are also provided. All rooms are equipped with a private bathroom.,https://www.booking.com/hotel/fr/b-amp-b-besancon.en-gb.html?aid=304142&label=gen173nr-1FCAEoggI46AdIM1gEaE2IAQGYAQm4AQrIAQXYAQHoAQH4AQOIAgGoAgO4AsnCy6IGwAIB0gIkZjdhN2UwNzAtMDk0NC00MWE4LWI3MjQtZjYzZDAzMWYyMzAz2AIG4AIB&ucfs=1&arphpl=1&checkin=2023-05-04&checkout=2023-05-08&group_adults=2&req_adults=2&no_rooms=1&group_children=0&req_children=0&hpos=22&hapos=22&sr_order=popularity&srpvid=8a309eae8d9900c4&srepoch=1683153246&all_sr_blocks=202119801_94664202_0_0_0&highlighted_blocks=202119801_94664202_0_0_0&matching_block_id=202119801_94664202_0_0_0&sr_pri_blocks=202119801_94664202_0_0_0__26520&from=searchresults#hotelTmpl
Biarritz,Le Rooftop des Halles,3,9.2,919,43.4804115,-1.5623812,"14 Rue du Centre, 64200 Biarritz, France","The air-conditioned apartment consists of 1 bedroom, a living room, a fully equipped kitchen with a fridge and a coffee machine, and 1 bathroom with a shower and free toiletries. Towels and bed linen are featured in the apartment.",https://www.booking.com/hotel/fr/le-rooftop-des-halles.en-gb.html?aid=304142&label=gen173bo-1DCAQoggJCD3NlYXJjaF9iaWFycml0ekgJWANoTYgBAZgBCbgBCsgBBdgBA-gBAfgBA4gCAZgCAqgCA7gC7cLLogbAAgHSAiQ5YTdmN2ZjZi0zODQzLTRiMzEtODdiYS1jNmE4NWY0YTFjNmXYAgTgAgE&ucfs=1&arphpl=1&checkin=2023-05-04&checkout=2023-05-08&group_adults=2&req_adults=2&no_rooms=1&group_children=0&req_children=0&hpos=13&hapos=38&sr_order=popularity&srpvid=92ee9eb6d3ab02da&srepoch=1683153263&all_sr_blocks=432818901_369725059_4_0_0&highlighted_blocks=432818901_369725059_4_0_0&matching_block_id=432818901_369725059_4_0_0&sr_pri_blocks=432818901_369725059_4_0_0__91944&from=searchresults#hotelTmpl
Biarritz,"Hôtel du Palais Biarritz, in The Unbound Collection by Hyatt",5,9.1,2254,43.48643904,-1.55621767,"1, Avenue de l'Impératrice, 64200 Biarritz, France","The air-conditioned rooms and suites at Hôtel du Palais Biarritz have a flat-screen TV with satellite channels, free Wi-Fi access and some have a separate seating area.",https://www.booking.com/hotel/fr/hoteldupalaisbiarritz.en-gb.html?aid=304142&label=gen173nr-1FCAEoggI46AdIM1gEaE2IAQGYAQm4AQrIAQXYAQHoAQH4AQOIAgGoAgO4AsnCy6IGwAIB0gIkZjdhN2UwNzAtMDk0NC00MWE4LWI3MjQtZjYzZDAzMWYyMzAz2AIG4AIB&ucfs=1&arphpl=1&checkin=2023-05-04&checkout=2023-05-08&group_adults=2&req_adults=2&no_rooms=1&group_children=0&req_children=0&hpos=20&hapos=20&sr_order=popularity&srpvid=27c09eae7e680284&srepoch=1683153247&all_sr_blocks=5148720_201394364_2_2_0&highlighted_blocks=5148720_201394364_2_2_0&matching_block_id=5148720_201394364_2_2_0&sr_pri_blocks=5148720_201394364_2_2_0__225384&from_sustainable_property_sr=1&from=searchresults#hotelTmpl
Biarritz,Le Garage Biarritz Hôtel,4,9.1,1534,43.490592,-1.551697,"50 Avenue de l'Impératrice, 64200 Biarritz, France","All guest rooms in the hotel are fitted with a kettle. All rooms include a coffee machine, a flat-screen TV and a safety deposit box, while selected rooms also offer a patio and some have city views.",https://www.booking.com/hotel/fr/le-garage-regina.en-gb.html?aid=304142&label=gen173nr-1FCAEoggI46AdIM1gEaE2IAQGYAQm4AQrIAQXYAQHoAQH4AQOIAgGoAgO4AsnCy6IGwAIB0gIkZjdhN2UwNzAtMDk0NC00MWE4LWI3MjQtZjYzZDAzMWYyMzAz2AIG4AIB&ucfs=1&arphpl=1&checkin=2023-05-04&checkout=2023-05-08&group_adults=2&req_adults=2&no_rooms=1&group_children=0&req_children=0&hpos=16&hapos=16&sr_order=popularity&srpvid=27c09eae7e680284&srepoch=1683153247&all_sr_blocks=739045602_328515343_2_2_0&highlighted_blocks=739045602_328515343_2_2_0&matching_block_id=739045602_328515343_2_2_0&sr_pri_blocks=739045602_328515343_2_2_0__153362&from_sustainable_property_sr=1&from=searchresults#hotelTmpl
Biarritz,Hotel Saint Julien,3,9.1,796,43.479139,-1.56227544,"20 Avenue Carnot, 64200 Biarritz, France",Breakfast is served every morning in the dining room or on the hotel’s terrace. It can also be served in your bedroom at an extra cost.,https://www.booking.com/hotel/fr/saint-julien.en-gb.html?aid=304142&label=gen173nr-1FCAEoggI46AdIM1gEaE2IAQGYAQm4AQrIAQXYAQHoAQH4AQOIAgGoAgO4AsnCy6IGwAIB0gIkZjdhN2UwNzAtMDk0NC00MWE4LWI3MjQtZjYzZDAzMWYyMzAz2AIG4AIB&ucfs=1&arphpl=1&checkin=2023-05-04&checkout=2023-05-08&group_adults=2&req_adults=2&no_rooms=1&group_children=0&req_children=0&hpos=3&hapos=3&sr_order=popularity&srpvid=27c09eae7e680284&srepoch=1683153247&all_sr_blocks=5354712_329996726_0_2_0&highlighted_blocks=5354712_329996726_0_2_0&matching_block_id=5354712_329996726_0_2_0&sr_pri_blocks=5354712_329996726_0_2_0__79620&from_sustainable_property_sr=1&from=searchresults#hotelTmpl
Biarritz,Easy Clés- Loft in front of the Port Vieux beach - Parking,4,9.0,2034,43.4820602,-1.56664225,"17 rue du port vieux, 64200 Biarritz, France","The apartment has 2 bedrooms, a TV with satellite channels, an equipped kitchen with a fridge and an oven, a washing machine, and 2 bathrooms with a shower. Towels and bed linen are offered in the apartment.",https://www.booking.com/hotel/fr/lakaz-splendid-loft-in-front-of-the-port-vieux-beach-aircon-and-parking.en-gb.html?aid=304142&label=gen173bo-1DCAQoggJCD3NlYXJjaF9iaWFycml0ekgJWANoTYgBAZgBCbgBCsgBBdgBA-gBAfgBA4gCAZgCAqgCA7gC7cLLogbAAgHSAiQ5YTdmN2ZjZi0zODQzLTRiMzEtODdiYS1jNmE4NWY0YTFjNmXYAgTgAgE&ucfs=1&arphpl=1&checkin=2023-05-04&checkout=2023-05-08&group_adults=2&req_adults=2&no_rooms=1&group_children=0&req_children=0&hpos=7&hapos=32&sr_order=popularity&srpvid=92ee9eb6d3ab02da&srepoch=1683153263&all_sr_blocks=538398502_347380038_4_0_0&highlighted_blocks=538398502_347380038_4_0_0&matching_block_id=538398502_347380038_4_0_0&sr_pri_blocks=538398502_347380038_4_0_0__203432&from=searchresults#hotelTmpl
Biarritz,Hotel de Silhouette,4,8.8,1997,43.48106773,-1.56320751,"30 rue Gambetta, 64200 Biarritz, France","Located at the heart of Biarritz, this hotel is just 350 yards from the beaches. It features a 24-hour reception, a terrace in the private garden and air-conditioned rooms.",https://www.booking.com/hotel/fr/de-silhouette-biarritz.en-gb.html?aid=304142&label=gen173nr-1FCAEoggI46AdIM1gEaE2IAQGYAQm4AQrIAQXYAQHoAQH4AQOIAgGoAgO4AsnCy6IGwAIB0gIkZjdhN2UwNzAtMDk0NC00MWE4LWI3MjQtZjYzZDAzMWYyMzAz2AIG4AIB&ucfs=1&arphpl=1&checkin=2023-05-04&checkout=2023-05-08&group_adults=2&req_adults=2&no_rooms=1&group_children=0&req_children=0&hpos=23&hapos=23&sr_order=popularity&srpvid=27c09eae7e680284&srepoch=1683153247&all_sr_blocks=30817202_95245458_2_2_0&highlighted_blocks=30817202_95245458_2_2_0&matching_block_id=30817202_95245458_2_2_0&sr_pri_blocks=30817202_95245458_2_2_0__199712&from_sustainable_property_sr=1&from=searchresults#hotelTmpl
Biarritz,Hôtel & Espace Bien-être La Maison du Lierre,3,8.8,946,43.48013354,-1.56076133,"3 avenue du Jardin Public, 64200 Biarritz, France","Hôtel & Espace Bien-être La Maison du Lierre is located in Biarritz, 350 yards from the beach and 5 minutes from the convention centres Bellevue, Casino and Gare du Midi as well as 100 yards from Biarritz central market. It offers free WiFi and Canal + channel.",https://www.booking.com/hotel/fr/la-maison-du-lierre.en-gb.html?aid=304142&label=gen173nr-1FCAEoggI46AdIM1gEaE2IAQGYAQm4AQrIAQXYAQHoAQH4AQOIAgGoAgO4AsnCy6IGwAIB0gIkZjdhN2UwNzAtMDk0NC00MWE4LWI3MjQtZjYzZDAzMWYyMzAz2AIG4AIB&ucfs=1&arphpl=1&checkin=2023-05-04&checkout=2023-05-08&group_adults=2&req_adults=2&no_rooms=1&group_children=0&req_children=0&hpos=9&hapos=9&sr_order=popularity&srpvid=27c09eae7e680284&srepoch=1683153247&all_sr_blocks=5388524_367897008_0_2_0&highlighted_blocks=5388524_367897008_0_2_0&matching_block_id=5388524_367897008_0_2_0&sr_pri_blocks=5388524_367897008_0_2_0__94620&from=searchresults#hotelTmpl
Biarritz,Haussman -Elegant 2 bedrooms flat in the heart of Biarritz- Parking,4,8.7,1466,43.480611,-1.562223,"5 rue du centre, 64200 Biarritz, France","Located in the centre of Biarritz, 550 yards from Grande Plage and 650 yards from Plage Pêcheurs, Haussman -Elegant 2 bedrooms flat in the heart of Biarritz- Parking offers free WiFi. Featuring free private parking, the apartment is in an area where guests can engage in activities such as hiking and cycling.",https://www.booking.com/hotel/fr/haussman-gorgeous-2-bedroom-apt-in-the-heart-of-les-halles-parking.en-gb.html?aid=304142&label=gen173bo-1DCAQoggJCD3NlYXJjaF9iaWFycml0ekgJWANoTYgBAZgBCbgBCsgBBdgBA-gBAfgBA4gCAZgCAqgCA7gC7cLLogbAAgHSAiQ5YTdmN2ZjZi0zODQzLTRiMzEtODdiYS1jNmE4NWY0YTFjNmXYAgTgAgE&ucfs=1&arphpl=1&checkin=2023-05-04&checkout=2023-05-08&group_adults=2&req_adults=2&no_rooms=1&group_children=0&req_children=0&hpos=9&hapos=34&sr_order=popularity&srpvid=92ee9eb6d3ab02da&srepoch=1683153263&all_sr_blocks=588313202_347380037_4_0_0&highlighted_blocks=588313202_347380037_4_0_0&matching_block_id=588313202_347380037_4_0_0&sr_pri_blocks=588313202_347380037_4_0_0__146614&from_sustainable_property_sr=1&from=searchresults#hotelTmpl
Biarritz,Easy Clés- Apartment with a stunning Ocean view - Parking,4,8.6,2143,43.481068,-1.56647,"29 Perspective de la Côte des Basques, 64200 Biarritz, France","Set in Biarritz and only 200 yards from Cote des Basques Beach, Easy Clés- Apartment with a stunning Ocean view - Parking offers accommodation with sea views, free WiFi and free private parking. It is situated 350 yards from Plage Port Vieux and features a concierge service.",https://www.booking.com/hotel/fr/elena-vue-imprenable-sur-l-ocean.en-gb.html?aid=304142&label=gen173nr-1FCAEoggI46AdIM1gEaE2IAQGYAQm4AQrIAQXYAQHoAQH4AQOIAgGoAgO4AsnCy6IGwAIB0gIkZjdhN2UwNzAtMDk0NC00MWE4LWI3MjQtZjYzZDAzMWYyMzAz2AIG4AIB&ucfs=1&arphpl=1&checkin=2023-05-04&checkout=2023-05-08&group_adults=2&req_adults=2&no_rooms=1&group_children=0&req_children=0&hpos=25&hapos=25&sr_order=popularity&srpvid=27c09eae7e680284&srepoch=1683153247&all_sr_blocks=477724202_347589660_4_0_0&highlighted_blocks=477724202_347589660_4_0_0&matching_block_id=477724202_347589660_4_0_0&sr_pri_blocks=477724202_347589660_4_0_0__214272&from=searchresults#hotelTmpl
Biarritz,Easy Clés- Apartment with a stunning Ocean view - Parking,4,8.6,2143,43.481068,-1.56647,"29 Perspective de la Côte des Basques, 64200 Biarritz, France","Set in Biarritz and only 200 yards from Cote des Basques Beach, Easy Clés- Apartment with a stunning Ocean view - Parking offers accommodation with sea views, free WiFi and free private parking. It is situated 350 yards from Plage Port Vieux and features a concierge service.",https://www.booking.com/hotel/fr/elena-vue-imprenable-sur-l-ocean.en-gb.html?aid=304142&label=gen173bo-1DCAQoggJCD3NlYXJjaF9iaWFycml0ekgJWANoTYgBAZgBCbgBCsgBBdgBA-gBAfgBA4gCAZgCAqgCA7gC7cLLogbAAgHSAiQ5YTdmN2ZjZi0zODQzLTRiMzEtODdiYS1jNmE4NWY0YTFjNmXYAgTgAgE&ucfs=1&arphpl=1&checkin=2023-05-04&checkout=2023-05-08&group_adults=2&req_adults=2&no_rooms=1&group_children=0&req_children=0&hpos=11&hapos=36&sr_order=popularity&srpvid=92ee9eb6d3ab02da&srepoch=1683153263&all_sr_blocks=477724202_347589660_4_0_0&highlighted_blocks=477724202_347589660_4_0_0&matching_block_id=477724202_347589660_4_0_0&sr_pri_blocks=477724202_347589660_4_0_0__214272&from=searchresults#hotelTmpl
Biarritz,Easy Clés- Bright 3 bedrooms flat next to Les Halles with parking,4,8.5,1935,43.48042439,-1.56369366,"2 Rue de la Fontaine, 64200 Biarritz, France","The apartment comes with 3 bedrooms, 2 bathrooms, bed linen, towels, a TV with satellite channels, a dining area, a fully equipped kitchen, and a terrace with city views.",https://www.booking.com/hotel/fr/kailua-halles-de-biarritz.en-gb.html?aid=304142&label=gen173bo-1DCAQoggJCD3NlYXJjaF9iaWFycml0ekgJWANoTYgBAZgBCbgBCsgBBdgBA-gBAfgBA4gCAZgCAqgCA7gC7cLLogbAAgHSAiQ5YTdmN2ZjZi0zODQzLTRiMzEtODdiYS1jNmE4NWY0YTFjNmXYAgTgAgE&ucfs=1&arphpl=1&checkin=2023-05-04&checkout=2023-05-08&group_adults=2&req_adults=2&no_rooms=1&group_children=0&req_children=0&hpos=8&hapos=33&sr_order=popularity&srpvid=92ee9eb6d3ab02da&srepoch=1683153263&all_sr_blocks=477720705_347589661_6_0_0&highlighted_blocks=477720705_347589661_6_0_0&matching_block_id=477720705_347589661_6_0_0&sr_pri_blocks=477720705_347589661_6_0_0__193512&from=searchresults#hotelTmpl
Biarritz,SANDY close to the center & the beach in Biarritz,3,8.4,790,43.4763498,-1.5515676,"7 Rue Ernest Renan 1er étage droite, 64200 Biarritz, France","The apartment is equipped with 2 bedrooms, a kitchen with fridge and oven, and 1 bathroom with a shower, free toiletries and a washing machine. Towels and bed linen are provided in the apartment.",https://www.booking.com/hotel/fr/sandy-close-to-the-center-the-beach-in-biarritz.en-gb.html?aid=304142&label=gen173nr-1FCAEoggI46AdIM1gEaE2IAQGYAQm4AQrIAQXYAQHoAQH4AQOIAgGoAgO4AsnCy6IGwAIB0gIkZjdhN2UwNzAtMDk0NC00MWE4LWI3MjQtZjYzZDAzMWYyMzAz2AIG4AIB&ucfs=1&arphpl=1&checkin=2023-05-04&checkout=2023-05-08&group_adults=2&req_adults=2&no_rooms=1&group_children=0&req_children=0&hpos=21&hapos=21&sr_order=popularity&srpvid=27c09eae7e680284&srepoch=1683153247&all_sr_blocks=534289402_352586528_4_0_0&highlighted_blocks=534289402_352586528_4_0_0&matching_block_id=534289402_352586528_4_0_0&sr_pri_blocks=534289402_352586528_4_0_0__78967&from=searchresults#hotelTmpl
Biarritz,SANDY close to the center & the beach in Biarritz,3,8.4,790,43.4763498,-1.5515676,"7 Rue Ernest Renan 1er étage droite, 64200 Biarritz, France","The apartment is equipped with 2 bedrooms, a kitchen with fridge and oven, and 1 bathroom with a shower, free toiletries and a washing machine. Towels and bed linen are provided in the apartment.",https://www.booking.com/hotel/fr/sandy-close-to-the-center-the-beach-in-biarritz.en-gb.html?aid=304142&label=gen173bo-1DCAQoggJCD3NlYXJjaF9iaWFycml0ekgJWANoTYgBAZgBCbgBCsgBBdgBA-gBAfgBA4gCAZgCAqgCA7gC7cLLogbAAgHSAiQ5YTdmN2ZjZi0zODQzLTRiMzEtODdiYS1jNmE4NWY0YTFjNmXYAgTgAgE&ucfs=1&arphpl=1&checkin=2023-05-04&checkout=2023-05-08&group_adults=2&req_adults=2&no_rooms=1&group_children=0&req_children=0&hpos=5&hapos=30&sr_order=popularity&srpvid=92ee9eb6d3ab02da&srepoch=1683153263&all_sr_blocks=534289402_352586528_4_0_0&highlighted_blocks=534289402_352586528_4_0_0&matching_block_id=534289402_352586528_4_0_0&sr_pri_blocks=534289402_352586528_4_0_0__78967&from=searchresults#hotelTmpl
Biarritz,Hôtel Maïtagaria,3,8.3,651,43.47897745,-1.56064063,"34 Avenue Carnot, 64200 Biarritz, France","Maïtagaria is situated in the heart of the famous surfing town of Biarritz, just 200 yards from the lively Place Clemenceau. The hotel offers modern accommodation and has ocean views.",https://www.booking.com/hotel/fr/maitagaria.en-gb.html?aid=304142&label=gen173nr-1FCAEoggI46AdIM1gEaE2IAQGYAQm4AQrIAQXYAQHoAQH4AQOIAgGoAgO4AsnCy6IGwAIB0gIkZjdhN2UwNzAtMDk0NC00MWE4LWI3MjQtZjYzZDAzMWYyMzAz2AIG4AIB&ucfs=1&arphpl=1&checkin=2023-05-04&checkout=2023-05-08&group_adults=2&req_adults=2&no_rooms=1&group_children=0&req_children=0&hpos=14&hapos=14&sr_order=popularity&srpvid=27c09eae7e680284&srepoch=1683153247&all_sr_blocks=28743306_99007860_0_2_0&highlighted_blocks=28743306_99007860_0_2_0&matching_block_id=28743306_99007860_0_2_0&sr_pri_blocks=28743306_99007860_0_2_0__65120&from_sustainable_property_sr=1&from=searchresults#hotelTmpl
Biarritz,Résidence Pierre & Vacances Premium Haguna,4,8.3,590,43.48534536,-1.5525806,"17, Avenue De La Reine Victoria, 64200 Biarritz, France","The studios and apartments at the Haguna residence are fully furnished and include a TV, a living area and a private bathroom. The kitchens include cooking facilities, dishwasher, fridge and microwave.",https://www.booking.com/hotel/fr/residence-pierre-vacances-haguna.en-gb.html?aid=304142&label=gen173nr-1FCAEoggI46AdIM1gEaE2IAQGYAQm4AQrIAQXYAQHoAQH4AQOIAgGoAgO4AsnCy6IGwAIB0gIkZjdhN2UwNzAtMDk0NC00MWE4LWI3MjQtZjYzZDAzMWYyMzAz2AIG4AIB&ucfs=1&arphpl=1&checkin=2023-05-04&checkout=2023-05-08&group_adults=2&req_adults=2&no_rooms=1&group_children=0&req_children=0&hpos=10&hapos=10&sr_order=popularity&srpvid=27c09eae7e680284&srepoch=1683153247&all_sr_blocks=5361705_258598734_4_0_0&highlighted_blocks=5361705_258598734_4_0_0&matching_block_id=5361705_258598734_4_0_0&sr_pri_blocks=5361705_258598734_4_0_0__58972&from=searchresults#hotelTmpl
Biarritz,Mercure Président Biarritz Plage,4,8.2,1256,43.4818647,-1.55975819,"18 Place Georges Clémenceau, 64200 Biarritz, France","Mercure Président Biarritz Plage air-conditioned and soundproofed rooms are bright and feature a design-style decor combining elegance and cosiness. The rooms an electric kettle with tea/coffee, and satellite TV.",https://www.booking.com/hotel/fr/mercure-le-president-biarritz-centre.en-gb.html?aid=304142&label=gen173nr-1FCAEoggI46AdIM1gEaE2IAQGYAQm4AQrIAQXYAQHoAQH4AQOIAgGoAgO4AsnCy6IGwAIB0gIkZjdhN2UwNzAtMDk0NC00MWE4LWI3MjQtZjYzZDAzMWYyMzAz2AIG4AIB&ucfs=1&arphpl=1&checkin=2023-05-04&checkout=2023-05-08&group_adults=2&req_adults=2&no_rooms=1&group_children=0&req_children=0&hpos=22&hapos=22&sr_order=popularity&srpvid=27c09eae7e680284&srepoch=1683153247&all_sr_blocks=18396908_246121428_2_2_0&highlighted_blocks=18396908_246121428_2_2_0&matching_block_id=18396908_246121428_2_2_0&sr_pri_blocks=18396908_246121428_2_2_0__125589&from_sustainable_property_sr=1&from=searchresults#hotelTmpl
Biarritz,COACHELLA Cozy apartment in famous St Charles Area,3,8.2,867,43.4866964,-1.5503418,"2 Rue d'Alsace 2e étage, 64200 Biarritz, France","Located 550 yards from Plage Miramar, 900 yards from Grande Plage and less than 0.6 miles from VVF Beach, COACHELLA Cozy apartment in famous St Charles Area provides accommodation set in Biarritz. It features a casino, city views and free WiFi throughout the property.",https://www.booking.com/hotel/fr/coachella-pretty-apartment-in-the-heart-of-biarritz.en-gb.html?aid=304142&label=gen173bo-1DCAQoggJCD3NlYXJjaF9iaWFycml0ekgJWANoTYgBAZgBCbgBCsgBBdgBA-gBAfgBA4gCAZgCAqgCA7gC7cLLogbAAgHSAiQ5YTdmN2ZjZi0zODQzLTRiMzEtODdiYS1jNmE4NWY0YTFjNmXYAgTgAgE&ucfs=1&arphpl=1&checkin=2023-05-04&checkout=2023-05-08&group_adults=2&req_adults=2&no_rooms=1&group_children=0&req_children=0&hpos=3&hapos=28&sr_order=popularity&srpvid=92ee9eb6d3ab02da&srepoch=1683153263&all_sr_blocks=535551702_349798471_4_0_0&highlighted_blocks=535551702_349798471_4_0_0&matching_block_id=535551702_349798471_4_0_0&sr_pri_blocks=535551702_349798471_4_0_0__86661&from=searchresults#hotelTmpl
Biarritz,Hôtel Georges VI,4,8.1,849,43.48218971,-1.5663591,"Rue du Port Vieux, 64200 Biarritz, France","The hotel George VI is located in Biarritz Port-Vieux, 50 yards from the beach. It has a patio garden and offers free Wi-Fi access in the guest rooms.",https://www.booking.com/hotel/fr/georges-vi.en-gb.html?aid=304142&label=gen173nr-1FCAEoggI46AdIM1gEaE2IAQGYAQm4AQrIAQXYAQHoAQH4AQOIAgGoAgO4AsnCy6IGwAIB0gIkZjdhN2UwNzAtMDk0NC00MWE4LWI3MjQtZjYzZDAzMWYyMzAz2AIG4AIB&ucfs=1&arphpl=1&checkin=2023-05-04&checkout=2023-05-08&group_adults=2&req_adults=2&no_rooms=1&group_children=0&req_children=0&hpos=13&hapos=13&sr_order=popularity&srpvid=27c09eae7e680284&srepoch=1683153247&all_sr_blocks=5901028_371360667_0_2_0&highlighted_blocks=5901028_371360667_0_2_0&matching_block_id=5901028_371360667_0_2_0&sr_pri_blocks=5901028_371360667_0_2_0__84912&from_sustainable_property_sr=1&from=searchresults#hotelTmpl
Biarritz,Mercure Plaza Biarritz Centre,4,8.0,1102,43.48288936,-1.55857265,"10 Avenue Edouard VII, 64200 Biarritz, France","The rooms were renovated in 2017 and are equipped with air conditioning, satellite TV with Canal+ channel, a safe, a work desk and a courtesy tray with coffee and tea. They are also serviced by a lift and some rooms have sea views.",https://www.booking.com/hotel/fr/biarritz-centre-plaza.en-gb.html?aid=304142&label=gen173nr-1FCAEoggI46AdIM1gEaE2IAQGYAQm4AQrIAQXYAQHoAQH4AQOIAgGoAgO4AsnCy6IGwAIB0gIkZjdhN2UwNzAtMDk0NC00MWE4LWI3MjQtZjYzZDAzMWYyMzAz2AIG4AIB&ucfs=1&arphpl=1&checkin=2023-05-04&checkout=2023-05-08&group_adults=2&req_adults=2&no_rooms=1&group_children=0&req_children=0&hpos=24&hapos=24&sr_order=popularity&srpvid=27c09eae7e680284&srepoch=1683153247&all_sr_blocks=5711405_309328474_2_2_0&highlighted_blocks=5711405_309328474_2_2_0&matching_block_id=5711405_309328474_2_2_0&sr_pri_blocks=5711405_309328474_2_2_0__110156&from=searchresults#hotelTmpl
Biarritz,Hotel De L'Océan,3,7.9,809,43.48257408,-1.56374395,"9 Place Sainte-Eugénie, 64200 Biarritz, France","Located on the place Sainte-Eugénie, a quiet, semi-pedestrian square above the old harbour. It is but a few steps away from all the beautiful sites on the city. You will be able to stroll around Biarritz and enjoy the city center and the seaside.",https://www.booking.com/hotel/fr/de-l-ocean.en-gb.html?aid=304142&label=gen173nr-1FCAEoggI46AdIM1gEaE2IAQGYAQm4AQrIAQXYAQHoAQH4AQOIAgGoAgO4AsnCy6IGwAIB0gIkZjdhN2UwNzAtMDk0NC00MWE4LWI3MjQtZjYzZDAzMWYyMzAz2AIG4AIB&ucfs=1&arphpl=1&checkin=2023-05-04&checkout=2023-05-08&group_adults=2&req_adults=2&no_rooms=1&group_children=0&req_children=0&hpos=8&hapos=8&sr_order=popularity&srpvid=27c09eae7e680284&srepoch=1683153247&all_sr_blocks=5748309_186000641_0_2_0&highlighted_blocks=5748309_186000641_0_2_0&matching_block_id=5748309_186000641_0_2_0&sr_pri_blocks=5748309_186000641_0_2_0__80920&from_sustainable_property_sr=1&from=searchresults#hotelTmpl
Bormes les Mimosas,APPART NEUF AU COEUR DU VILLAGE DE COLLOBRIERES,3,10.0,340,43.23641791,6.31030621,"2 Place Général de Gaulle, 83610 Collobrières, France","APPART NEUF AU COEUR DU VILLAGE DE COLLOBRIERES in Collobrières offers accommodation with free WiFi, 27.3 miles from Toulon Train Station, 27.3 miles from Zenith de Toulon and 16.2 miles from La Favière. This apartment is 20.5 miles from Beauvallon Golf and 23.6 miles from University of the South, Toulon-Var.",https://www.booking.com/hotel/fr/appart-neuf-au-coeur-du-village-de-collobrieres.en-gb.html?aid=304142&label=gen173bo-1DCAQoggJCGXNlYXJjaF9ib3JtZXMgbGVzIG1pbW9zYXNICVgDaE2IAQGYAQm4AQrIAQXYAQPoAQH4AQOIAgGYAgKoAgO4AuvCy6IGwAIB0gIkZTNkM2E5MGUtNTJlOC00OGRmLWJhMDQtMmUwY2M0ZmNmODc02AIE4AIB&ucfs=1&arphpl=1&checkin=2023-05-04&checkout=2023-05-08&group_adults=2&req_adults=2&no_rooms=1&group_children=0&req_children=0&hpos=23&hapos=73&sr_order=popularity&srpvid=96f39eb5ee060510&srepoch=1683153261&all_sr_blocks=905846501_362145950_4_0_0&highlighted_blocks=905846501_362145950_4_0_0&matching_block_id=905846501_362145950_4_0_0&sr_pri_blocks=905846501_362145950_4_0_0__33975&from=searchresults#hotelTmpl
Bormes les Mimosas,"Le Rossignol 3, Aiguebelle plage, Le Lavandou",4,9.8,643,43.1499048,6.407299,"4 Corniche des Pins, 83980 Le Lavandou, France","The air-conditioned apartment consists of 1 bedroom, a living room, a fully equipped kitchen with a fridge and a coffee machine, and 1 bathroom with a shower. Featuring free private parking, this 4-star apartment also features free WiFi.",https://www.booking.com/hotel/fr/le-rossignol-3.en-gb.html?aid=304142&label=gen173bo-1DCAQoggJCGXNlYXJjaF9ib3JtZXMgbGVzIG1pbW9zYXNICVgDaE2IAQGYAQm4AQrIAQXYAQPoAQH4AQOIAgGYAgKoAgO4AuzCy6IGwAIB0gIkMzMwOGVjNWYtODU3Ni00ODM0LTk4ODctODEyZGNkNDhlOTJk2AIE4AIB&ucfs=1&arphpl=1&checkin=2023-05-04&checkout=2023-05-08&group_adults=2&req_adults=2&no_rooms=1&group_children=0&req_children=0&hpos=19&hapos=44&sr_order=popularity&srpvid=4ee09eb6fae401ca&srepoch=1683153262&all_sr_blocks=861253901_372868640_4_0_0&highlighted_blocks=861253901_372868640_4_0_0&matching_block_id=861253901_372868640_4_0_0&sr_pri_blocks=861253901_372868640_4_0_0__64328&from=searchresults#hotelTmpl
Bormes les Mimosas,"Le Rossignol 1, Aiguebelle plage",4,9.7,1097,43.1499048,6.407299,"4 Corniche des Pins, 83980 Le Lavandou, France","The air-conditioned apartment consists of 2 bedrooms, a living room, a fully equipped kitchen with a fridge and a coffee machine, and 2 bathrooms with a shower and a hairdryer. Towels and bed linen are provided in the apartment.",https://www.booking.com/hotel/fr/le-rossignol-le-lavandou.en-gb.html?aid=304142&label=gen173bo-1DCAQoggJCGXNlYXJjaF9ib3JtZXMgbGVzIG1pbW9zYXNICVgDaE2IAQGYAQm4AQrIAQXYAQPoAQH4AQOIAgGYAgKoAgO4AuzCy6IGwAIB0gIkMzMwOGVjNWYtODU3Ni00ODM0LTk4ODctODEyZGNkNDhlOTJk2AIE4AIB&ucfs=1&arphpl=1&checkin=2023-05-04&checkout=2023-05-08&group_adults=2&req_adults=2&no_rooms=1&group_children=0&req_children=0&hpos=20&hapos=45&sr_order=popularity&srpvid=4ee09eb6fae401ca&srepoch=1683153262&all_sr_blocks=842345701_372868698_6_0_0&highlighted_blocks=842345701_372868698_6_0_0&matching_block_id=842345701_372868698_6_0_0&sr_pri_blocks=842345701_372868698_6_0_0__109688&from=searchresults#hotelTmpl
