city,hotel_names,stars,rating,price,hotel_lat,hotel_lon,adresses,descriptions,link
Eguisheim,Appartement de Prestige au centre avec jardin privé,3,9.1,1168,48.077116,7.3667839,"5 Rue du Rhin, 68000 Colmar, France","The apartment consists of 3 bedrooms, a living room, a fully equipped kitchen with a fridge and a coffee machine, and 1 bathroom with a bath or shower and a hairdryer. A flat-screen TV with cable channels is featured.",https://www.booking.com/hotel/fr/appartement-de-prestige-a-2-pas-du-centre-ville-colmar12.en-gb.html?aid=304142&label=gen173bo-1DCAQoggJCEHNlYXJjaF9lZ3Vpc2hlaW1ICVgDaE2IAQGYAQm4AQrIAQXYAQPoAQH4AQOIAgGYAgKoAgO4AoPDy6IGwAIB0gIkODIzZWQ0MDItZDg0MC00YWMxLTg3ZDUtYzg5ZGI0MDAyNGM12AIE4AIB&ucfs=1&arphpl=1&checkin=2023-05-04&checkout=2023-05-08&group_adults=2&req_adults=2&no_rooms=1&group_children=0&req_children=0&hpos=2&hapos=52&sr_order=popularity&srpvid=a60e9ec146350098&srepoch=1683153284&all_sr_blocks=839147701_350406632_8_0_0&highlighted_blocks=839147701_350406632_8_0_0&matching_block_id=839147701_350406632_8_0_0&sr_pri_blocks=839147701_350406632_8_0_0__116784&from=searchresults#hotelTmpl
Eguisheim,NEW ! Sur les Quais de Colmar avec parking inclus 1710,3,9.1,997,48.07436303,7.36021489,"17, Quai de la Poissonnerie, 68000 Colmar, France",Sur les Quais de Colmar features a TV and an iPod docking station. It includes a private bathroom with a bath and a shower. It is equipped with a vacuum cleaner.,https://www.booking.com/hotel/fr/sur-les-quais-de-colmar.en-gb.html?aid=304142&label=gen173bo-1DCAQoggJCEHNlYXJjaF9lZ3Vpc2hlaW1ICVgDaE2IAQGYAQm4AQrIAQXYAQPoAQH4AQOIAgGYAgKoAgO4AoPDy6IGwAIB0gIkMTQ1ODI4ODQtMDdjMC00MDA0LThhM2UtNzRmMDY5NTZlYTBm2AIE4AIB&ucfs=1&arphpl=1&checkin=2023-05-04&checkout=2023-05-08&group_adults=2&req_adults=2&no_rooms=1&group_children=0&req_children=0&hpos=18&hapos=43&sr_order=popularity&srpvid=bb9e9ec150c70161&srepoch=1683153285&all_sr_blocks=42295501_356910285_2_0_0&highlighted_blocks=42295501_356910285_2_0_0&matching_block_id=42295501_356910285_2_0_0&sr_pri_blocks=42295501_356910285_2_0_0__99684&from=searchresults#hotelTmpl
Eguisheim,"Hello Colmar, Duplex Cathedrale, historic center",4,9.0,2027,48.0780542,7.3577883,"6 Rue des Serruriers, 68000 Colmar, France","This duplex two-bedroom apartment feature a living room and an open space with 2 sofa beds. It also has a dining room with a wooden dining table and a large open-plan kitchen with a Nespresso coffee machine, a dishwasher and a microwave. A breakfast bar and a fridge are also at guests' disposal.",https://www.booking.com/hotel/fr/hello-colmar-duplex-cathedrale-historic-center.en-gb.html?aid=304142&label=gen173bo-1DCAQoggJCEHNlYXJjaF9lZ3Vpc2hlaW1ICVgDaE2IAQGYAQm4AQrIAQXYAQPoAQH4AQOIAgGYAgKoAgO4AoPDy6IGwAIB0gIkMTQ1ODI4ODQtMDdjMC00MDA0LThhM2UtNzRmMDY5NTZlYTBm2AIE4AIB&ucfs=1&arphpl=1&checkin=2023-05-04&checkout=2023-05-08&group_adults=2&req_adults=2&no_rooms=1&group_children=0&req_children=0&hpos=12&hapos=37&sr_order=popularity&srpvid=bb9e9ec150c70161&srepoch=1683153285&all_sr_blocks=504765001_182349292_8_0_0&highlighted_blocks=504765001_182349292_8_0_0&matching_block_id=504765001_182349292_8_0_0&sr_pri_blocks=504765001_182349292_8_0_0__202720&from=searchresults#hotelTmpl
Eguisheim,James Boutique Hôtel Colmar centre,4,9.0,1038,48.07934802,7.3644799,"15 rue Saint-Eloi, 68000 Colmar, France","James Boutique Hôtel Colmar centre offers accommodation in Colmar, on the Alsation Wine Route. This Boutique Hotel offers a contemporary and modern decoration style. Guests can enjoy the on-site bar. Private parking is available on site.",https://www.booking.com/hotel/fr/james-boutique-hotel.en-gb.html?aid=304142&label=gen173bo-1DCAQoggJCEHNlYXJjaF9lZ3Vpc2hlaW1ICVgDaE2IAQGYAQm4AQrIAQXYAQPoAQH4AQOIAgGYAgKoAgO4AoPDy6IGwAIB0gIkODIzZWQ0MDItZDg0MC00YWMxLTg3ZDUtYzg5ZGI0MDAyNGM12AIE4AIB&ucfs=1&arphpl=1&checkin=2023-05-04&checkout=2023-05-08&group_adults=2&req_adults=2&no_rooms=1&group_children=0&req_children=0&hpos=11&hapos=61&sr_order=popularity&srpvid=a60e9ec146350098&srepoch=1683153284&all_sr_blocks=189017405_343187698_0_2_0&highlighted_blocks=189017405_343187698_0_2_0&matching_block_id=189017405_343187698_0_2_0&sr_pri_blocks=189017405_343187698_0_2_0__103800&from=searchresults#hotelTmpl
Eguisheim,Gîte Aux Quatre Vents avec Terrasse,3,9.0,909,47.9598221,7.2998257,"13 Rue aux Quatre Vents, 68250 Rouffach, France","Within 9.3 miles of Colmar Train Station and 9.9 miles of House of the Heads, Gîte Aux Quatre Vents avec Terrasse features free WiFi and a terrace. This holiday home is 9.9 miles from Saint-Martin Collegiate Church and 11.8 miles from Colmar Expo.",https://www.booking.com/hotel/fr/aux-quatre-vents-rouffach.en-gb.html?aid=304142&label=gen173bo-1DCAQoggJCEHNlYXJjaF9lZ3Vpc2hlaW1ICVgDaE2IAQGYAQm4AQrIAQXYAQPoAQH4AQOIAgGYAgKoAgO4AoLDy6IGwAIB0gIkMThmZDJlODctMDdmOC00ZWNjLTg3ZDQtZDdjMTA2ZmUxYzZh2AIE4AIB&ucfs=1&arphpl=1&checkin=2023-05-04&checkout=2023-05-08&group_adults=2&req_adults=2&no_rooms=1&group_children=0&req_children=0&hpos=11&hapos=86&sr_order=popularity&srpvid=b80b9ec13974017a&srepoch=1683153284&all_sr_blocks=927460001_364754027_6_0_0&highlighted_blocks=927460001_364754027_6_0_0&matching_block_id=927460001_364754027_6_0_0&sr_pri_blocks=927460001_364754027_6_0_0__90929&from=searchresults#hotelTmpl
Gorges du Verdon,Pigeonnier des Banons,3,9.6,726,43.88014493,6.12043298,"Pas de Laval, 04410 Puimoisson, France",The room feature a seating area and a private bathroom with free toiletries and a hairdryer. Enjoy a cup of tea from your terrace. The wooden caravan is equipped with a kitchen and a private bathroom. There is also a fully equipped holiday home.,https://www.booking.com/hotel/fr/pigeonnier-des-banons.en-gb.html?aid=304142&label=gen173bo-1DCAQoggJCF3NlYXJjaF9nb3JnZXMgZHUgdmVyZG9uSAlYA2hNiAEBmAEJuAEKyAEF2AED6AEB-AEDiAIBmAICqAIDuAKCw8uiBsACAdICJGEyOTFlMGQ3LTgzOTctNGEzMy04YTJlLTMwNWNmMDY2OThkZNgCBOACAQ&ucfs=1&arphpl=1&checkin=2023-05-04&checkout=2023-05-08&group_adults=2&req_adults=2&no_rooms=1&group_children=0&req_children=0&hpos=9&hapos=59&sr_order=popularity&srpvid=f3a39ec167300007&srepoch=1683153283&all_sr_blocks=172692801_326760344_2_1_0&highlighted_blocks=172692801_326760344_2_1_0&matching_block_id=172692801_326760344_2_1_0&sr_pri_blocks=172692801_326760344_2_1_0__72616&from_sustainable_property_sr=1&from=searchresults#hotelTmpl
Gorges du Verdon,"Lou Paran ""Le Jardin""",3,9.6,543,43.84756703,6.5127836,"Rue Saint-Victor, 04120 Castellane, France","Featuring garden views, Lou Paran ""Le Jardin"" provides accommodation with a patio and a coffee machine, around 11.8 miles from Château de Taulane Golf Course. Guests have access to free WiFi throughout the property.",https://www.booking.com/hotel/fr/lou-paran.en-gb.html?aid=304142&label=gen173nr-1FCAEoggI46AdIM1gEaE2IAQGYAQm4AQrIAQXYAQHoAQH4AQOIAgGoAgO4AsnCy6IGwAIB0gIkZjdhN2UwNzAtMDk0NC00MWE4LWI3MjQtZjYzZDAzMWYyMzAz2AIG4AIB&ucfs=1&arphpl=1&checkin=2023-05-04&checkout=2023-05-08&group_adults=2&req_adults=2&no_rooms=1&group_children=0&req_children=0&hpos=25&hapos=25&sr_order=popularity&srpvid=af409ebd4bf50187&srepoch=1683153276&all_sr_blocks=429166001_295648003_4_0_0&highlighted_blocks=429166001_295648003_4_0_0&matching_block_id=429166001_295648003_4_0_0&sr_pri_blocks=429166001_295648003_4_0_0__54340&from=searchresults#hotelTmpl
Gorges du Verdon,"Appartement de charme, spacieux, Moustiers #5",3,9.5,598,43.84809185,6.22167112,"Rue des Rosiers, 04360 Moustiers-Sainte-Marie, France","The apartment is located on the ground floor and is fitted with 1 bedroom, a flat-screen TV and a fully equipped kitchen that provides guests with a fridge, an oven, a washing machine, a dishwasher and a microwave. Towels and bed linen are offered in the apartment.",https://www.booking.com/hotel/fr/appartement-de-charme-spacieux-moustiers-5.en-gb.html?aid=304142&label=gen173bo-1DCAQoggJCF3NlYXJjaF9nb3JnZXMgZHUgdmVyZG9uSAlYA2hNiAEBmAEJuAEKyAEF2AED6AEB-AEDiAIBmAICqAIDuAKBw8uiBsACAdICJGRjZTEwMzAzLWY2NGYtNDNjNC04MGJmLTJkMjExYjZlYjBhNdgCBOACAQ&ucfs=1&arphpl=1&checkin=2023-05-04&checkout=2023-05-08&group_adults=2&req_adults=2&no_rooms=1&group_children=0&req_children=0&hpos=13&hapos=88&sr_order=popularity&srpvid=3ca69ec0f7100108&srepoch=1683153283&all_sr_blocks=590254901_242930550_2_0_0&highlighted_blocks=590254901_242930550_2_0_0&matching_block_id=590254901_242930550_2_0_0&sr_pri_blocks=590254901_242930550_2_0_0__59800&from=searchresults#hotelTmpl
Gorges du Verdon,Atelier Soleil,3,9.4,500,43.84060849,6.21766627,"Chemin de quinson, 04360 Moustiers-Sainte-Marie, France",At Atelier Soleil you will find a garden and a terrace. Other facilities offered at the property include a vending machine. The property offers free parking.,https://www.booking.com/hotel/fr/atelier-soleil-moustiers-sainte-marie.en-gb.html?aid=304142&label=gen173bo-1DCAQoggJCF3NlYXJjaF9nb3JnZXMgZHUgdmVyZG9uSAlYA2hNiAEBmAEJuAEKyAEF2AED6AEB-AEDiAIBmAICqAIDuAKEw8uiBsACAdICJDE0YzYzYmRhLTk4N2ItNDE0NC04NmY4LWI0YzkyNDNiYzJjZdgCBOACAQ&ucfs=1&arphpl=1&checkin=2023-05-04&checkout=2023-05-08&group_adults=2&req_adults=2&no_rooms=1&group_children=0&req_children=0&hpos=5&hapos=30&sr_order=popularity&srpvid=11fa9ec2d9d903f3&srepoch=1683153285&all_sr_blocks=132698301_166450168_2_0_0&highlighted_blocks=132698301_166450168_2_0_0&matching_block_id=132698301_166450168_2_0_0&sr_pri_blocks=132698301_166450168_2_0_0__50000&from=searchresults#hotelTmpl
Gorges du Verdon,"Spacieux, terrasse, vue imprenable Moustiers #6",3,9.3,625,43.848164,6.221684,"Rue des Rosiers, 04360 Moustiers-Sainte-Marie, France","This air-conditioned apartment is fitted with 1 bedroom, a cable flat-screen TV, a dining area, and a kitchen with a fridge and a dishwasher. Towels and bed linen are featured in the apartment.",https://www.booking.com/hotel/fr/spacieux-terrasse-vue-imprenable-moustiers-6.en-gb.html?aid=304142&label=gen173bo-1DCAQoggJCF3NlYXJjaF9nb3JnZXMgZHUgdmVyZG9uSAlYA2hNiAEBmAEJuAEKyAEF2AED6AEB-AEDiAIBmAICqAIDuAKBw8uiBsACAdICJGRjZTEwMzAzLWY2NGYtNDNjNC04MGJmLTJkMjExYjZlYjBhNdgCBOACAQ&ucfs=1&arphpl=1&checkin=2023-05-04&checkout=2023-05-08&group_adults=2&req_adults=2&no_rooms=1&group_children=0&req_children=0&hpos=2&hapos=77&sr_order=popularity&srpvid=3ca69ec0f7100108&srepoch=1683153283&all_sr_blocks=752411801_331799500_2_0_0&highlighted_blocks=752411801_331799500_2_0_0&matching_block_id=752411801_331799500_2_0_0&sr_pri_blocks=752411801_331799500_2_0_0__62480&from_sustainable_property_sr=1&from=searchresults#hotelTmpl
Gorges du Verdon,"Studio industriel, vue sur l’étoile, Moustiers #4",3,9.2,502,43.848164,6.221684,"Rue des Rosiers, 04360 Moustiers-Sainte-Marie, France","The air-conditioned apartment is composed of 1 separate bedroom, a fully equipped kitchen with a fridge and a microwave, and 1 bathroom. Towels and bed linen are featured in the apartment.",https://www.booking.com/hotel/fr/studio-industriel-vue-sur-l-etoile-moustiers-4.en-gb.html?aid=304142&label=gen173bo-1DCAQoggJCF3NlYXJjaF9nb3JnZXMgZHUgdmVyZG9uSAlYA2hNiAEBmAEJuAEKyAEF2AED6AEB-AEDiAIBmAICqAIDuAKCw8uiBsACAdICJGEyOTFlMGQ3LTgzOTctNGEzMy04YTJlLTMwNWNmMDY2OThkZNgCBOACAQ&ucfs=1&arphpl=1&checkin=2023-05-04&checkout=2023-05-08&group_adults=2&req_adults=2&no_rooms=1&group_children=0&req_children=0&hpos=21&hapos=71&sr_order=popularity&srpvid=f3a39ec167300007&srepoch=1683153283&all_sr_blocks=795907001_339724796_2_0_0&highlighted_blocks=795907001_339724796_2_0_0&matching_block_id=795907001_339724796_2_0_0&sr_pri_blocks=795907001_339724796_2_0_0__50180&from=searchresults#hotelTmpl
Gorges du Verdon,Le Jasmin,3,9.2,316,43.77998629,6.09911418,"Route de Moustiers, 04500 Montagnac, France",The rooms have a flat-screen TV. All rooms have a private bathroom.,https://www.booking.com/hotel/fr/le-jasmin-montagnac-montpezat.en-gb.html?aid=304142&label=gen173bo-1DCAQoggJCF3NlYXJjaF9nb3JnZXMgZHUgdmVyZG9uSAlYA2hNiAEBmAEJuAEKyAEF2AED6AEB-AEDiAIBmAICqAIDuAKEw8uiBsACAdICJDE0YzYzYmRhLTk4N2ItNDE0NC04NmY4LWI0YzkyNDNiYzJjZdgCBOACAQ&ucfs=1&arphpl=1&checkin=2023-05-04&checkout=2023-05-08&group_adults=2&req_adults=2&no_rooms=1&group_children=0&req_children=0&hpos=2&hapos=27&sr_order=popularity&srpvid=11fa9ec2d9d903f3&srepoch=1683153285&all_sr_blocks=251986001_326764372_2_2_0&highlighted_blocks=251986001_326764372_2_2_0&matching_block_id=251986001_326764372_2_2_0&sr_pri_blocks=251986001_326764372_2_2_0__31600&from=searchresults#hotelTmpl
Gorges du Verdon,"Studio vue sur la roche, au calme Moustiers #1",3,9.1,461,43.848164,6.221684,"Rue des Rosiers, 04360 Moustiers-Sainte-Marie, France","The air-conditioned apartment is composed of 1 separate bedroom, a fully equipped kitchen with a fridge and a microwave, and 1 bathroom. Towels and bed linen are available in the apartment.",https://www.booking.com/hotel/fr/studio-vue-sur-la-roche-au-calme-moustiers-1.en-gb.html?aid=304142&label=gen173bo-1DCAQoggJCF3NlYXJjaF9nb3JnZXMgZHUgdmVyZG9uSAlYA2hNiAEBmAEJuAEKyAEF2AED6AEB-AEDiAIBmAICqAIDuAKBw8uiBsACAdICJGRjZTEwMzAzLWY2NGYtNDNjNC04MGJmLTJkMjExYjZlYjBhNdgCBOACAQ&ucfs=1&arphpl=1&checkin=2023-05-04&checkout=2023-05-08&group_adults=2&req_adults=2&no_rooms=1&group_children=0&req_children=0&hpos=4&hapos=79&sr_order=popularity&srpvid=3ca69ec0f7100108&srepoch=1683153283&all_sr_blocks=795264801_339608619_2_0_0&highlighted_blocks=795264801_339608619_2_0_0&matching_block_id=795264801_339608619_2_0_0&sr_pri_blocks=795264801_339608619_2_0_0__46080&from=searchresults#hotelTmpl
Gorges du Verdon,Le Moulin du Verdon,2,9.1,406,43.7562008,5.8902972,"avenue du verdon, 04800 Gréoux-les-Bains, France","The studios feature a kitchenette equipped with an oven, microwave and coffee machine. The private bathrooms have a shower and a toilet. Bed linen is available.",https://www.booking.com/hotel/fr/residence-le-moulin.en-gb.html?aid=304142&label=gen173bo-1DCAQoggJCF3NlYXJjaF9nb3JnZXMgZHUgdmVyZG9uSAlYA2hNiAEBmAEJuAEKyAEF2AED6AEB-AEDiAIBmAICqAIDuAKEw8uiBsACAdICJDE0YzYzYmRhLTk4N2ItNDE0NC04NmY4LWI0YzkyNDNiYzJjZdgCBOACAQ&ucfs=1&arphpl=1&checkin=2023-05-04&checkout=2023-05-08&group_adults=2&req_adults=2&no_rooms=1&group_children=0&req_children=0&hpos=6&hapos=31&sr_order=popularity&srpvid=11fa9ec2d9d903f3&srepoch=1683153285&all_sr_blocks=136252001_328159514_2_2_0&highlighted_blocks=136252001_328159514_2_2_0&matching_block_id=136252001_328159514_2_2_0&sr_pri_blocks=136252001_328159514_2_2_0__40592&from_sustainable_property_sr=1&from=searchresults#hotelTmpl
Gorges du Verdon,Camping Manaysse,2,9.1,382,43.84496499,6.21544732,"4 avenue frederic mistral, 04360 Moustiers-Sainte-Marie, France","Some units also have a kitchen equipped with a fridge, a microwave, and a stovetop.",https://www.booking.com/hotel/fr/camping-manaysse.en-gb.html?aid=304142&label=gen173bo-1DCAQoggJCF3NlYXJjaF9nb3JnZXMgZHUgdmVyZG9uSAlYA2hNiAEBmAEJuAEKyAEF2AED6AEB-AEDiAIBmAICqAIDuAKEw8uiBsACAdICJDE0YzYzYmRhLTk4N2ItNDE0NC04NmY4LWI0YzkyNDNiYzJjZdgCBOACAQ&ucfs=1&arphpl=1&checkin=2023-05-04&checkout=2023-05-08&group_adults=2&req_adults=2&no_rooms=1&group_children=0&req_children=0&hpos=4&hapos=29&sr_order=popularity&srpvid=11fa9ec2d9d903f3&srepoch=1683153285&all_sr_blocks=505189904_173523852_0_0_0&highlighted_blocks=505189904_173523852_0_0_0&matching_block_id=505189904_173523852_0_0_0&sr_pri_blocks=505189904_173523852_0_0_0__38176&from=searchresults#hotelTmpl
Gorges du Verdon,Hotel Les Restanques De Moustiers,3,9.0,733,43.83962281,6.22201681,"Route Des Gorges Du Verdon, 04360 Moustiers-Sainte-Marie, France",Guest rooms are decorated in warm colours with floor-to-ceiling windows allowing plenty of natural light. They are equipped with a flat-screen TV and feature a private bathroom.,https://www.booking.com/hotel/fr/les-restanques-de-moustiers.en-gb.html?aid=304142&label=gen173bo-1DCAQoggJCF3NlYXJjaF9nb3JnZXMgZHUgdmVyZG9uSAlYA2hNiAEBmAEJuAEKyAEF2AED6AEB-AEDiAIBmAICqAIDuAKEw8uiBsACAdICJDE0YzYzYmRhLTk4N2ItNDE0NC04NmY4LWI0YzkyNDNiYzJjZdgCBOACAQ&ucfs=1&arphpl=1&checkin=2023-05-04&checkout=2023-05-08&group_adults=2&req_adults=2&no_rooms=1&group_children=0&req_children=0&hpos=1&hapos=26&sr_order=popularity&srpvid=11fa9ec2d9d903f3&srepoch=1683153285&all_sr_blocks=29543308_326752595_2_0_0&highlighted_blocks=29543308_326752595_2_0_0&matching_block_id=29543308_326752595_2_0_0&sr_pri_blocks=29543308_326752595_2_0_0__73320&from_sustainable_property_sr=1&from=searchresults#hotelTmpl
Gorges du Verdon,Maison Coquette Hameau de Montagne,3,9.0,645,43.86790291,6.46881897,"Sionne, 04120 Castellane, France","The holiday home features a terrace, 2 bedrooms, a living room and a well-equipped kitchen with a fridge and a stovetop. For added convenience, the property can provide towels and bed linen for an extra charge.",https://www.booking.com/hotel/fr/maison-coquette-hameau-de-montagne.en-gb.html?aid=304142&label=gen173bo-1DCAQoggJCF3NlYXJjaF9nb3JnZXMgZHUgdmVyZG9uSAlYA2hNiAEBmAEJuAEKyAEF2AED6AEB-AEDiAIBmAICqAIDuAKCw8uiBsACAdICJGEyOTFlMGQ3LTgzOTctNGEzMy04YTJlLTMwNWNmMDY2OThkZNgCBOACAQ&ucfs=1&arphpl=1&checkin=2023-05-04&checkout=2023-05-08&group_adults=2&req_adults=2&no_rooms=1&group_children=0&req_children=0&hpos=18&hapos=68&sr_order=popularity&srpvid=f3a39ec167300007&srepoch=1683153283&all_sr_blocks=942608601_366463200_2_0_0&highlighted_blocks=942608601_366463200_2_0_0&matching_block_id=942608601_366463200_2_0_0&sr_pri_blocks=942608601_366463200_2_0_0__64497&from=searchresults#hotelTmpl
Gorges du Verdon,"Studio vue sur les toits, lumineux Moustiers #2",3,9.0,502,43.84809726,6.22172557,"Rue des Rosiers, 04360 Moustiers-Sainte-Marie, France","This air-conditioned apartment is equipped with 1 bedroom, a flat-screen TV, and a kitchenette.",https://www.booking.com/hotel/fr/studio-vue-sur-les-toits-lumineux-moustiers-2.en-gb.html?aid=304142&label=gen173bo-1DCAQoggJCF3NlYXJjaF9nb3JnZXMgZHUgdmVyZG9uSAlYA2hNiAEBmAEJuAEKyAEF2AED6AEB-AEDiAIBmAICqAIDuAKCw8uiBsACAdICJGEyOTFlMGQ3LTgzOTctNGEzMy04YTJlLTMwNWNmMDY2OThkZNgCBOACAQ&ucfs=1&arphpl=1&checkin=2023-05-04&checkout=2023-05-08&group_adults=2&req_adults=2&no_rooms=1&group_children=0&req_children=0&hpos=23&hapos=73&sr_order=popularity&srpvid=f3a39ec167300007&srepoch=1683153283&all_sr_blocks=746218901_330574813_2_0_0&highlighted_blocks=746218901_330574813_2_0_0&matching_block_id=746218901_330574813_2_0_0&sr_pri_blocks=746218901_330574813_2_0_0__50180&from=searchresults#hotelTmpl
Gorges du Verdon,"Le ""M"" Maison d hôtes",3,9.0,466,43.817658,6.093181,"12, Place Saint Antoine, 04500 Riez, France","At the bed and breakfast, all rooms are equipped with a wardrobe, a flat-screen TV and a private bathroom.The rooms are all accessible via a spiral staircase.",https://www.booking.com/hotel/fr/le-quot-m-quot-maison-d-hotes.en-gb.html?aid=304142&label=gen173bo-1DCAQoggJCF3NlYXJjaF9nb3JnZXMgZHUgdmVyZG9uSAlYA2hNiAEBmAEJuAEKyAEF2AED6AEB-AEDiAIBmAICqAIDuAKEw8uiBsACAdICJDE0YzYzYmRhLTk4N2ItNDE0NC04NmY4LWI0YzkyNDNiYzJjZdgCBOACAQ&ucfs=1&arphpl=1&checkin=2023-05-04&checkout=2023-05-08&group_adults=2&req_adults=2&no_rooms=1&group_children=0&req_children=0&hpos=11&hapos=36&sr_order=popularity&srpvid=11fa9ec2d9d903f3&srepoch=1683153285&all_sr_blocks=341577302_256681451_0_0_0&highlighted_blocks=341577302_256681451_0_0_0&matching_block_id=341577302_256681451_0_0_0&sr_pri_blocks=341577302_256681451_0_0_0__46616&from=searchresults#hotelTmpl
Gorges du Verdon,"Studio vue sur le clocher, au calme Moustiers #3",3,9.0,461,43.848164,6.221684,"Rue des Rosiers, 04360 Moustiers-Sainte-Marie, France","The air-conditioned apartment is composed of 1 separate bedroom, a fully equipped kitchen with a fridge and a microwave, and 1 bathroom. Towels and bed linen are featured in the apartment.",https://www.booking.com/hotel/fr/studio-vue-sur-le-clocher-au-calme-moustiers-3.en-gb.html?aid=304142&label=gen173bo-1DCAQoggJCF3NlYXJjaF9nb3JnZXMgZHUgdmVyZG9uSAlYA2hNiAEBmAEJuAEKyAEF2AED6AEB-AEDiAIBmAICqAIDuAKCw8uiBsACAdICJGEyOTFlMGQ3LTgzOTctNGEzMy04YTJlLTMwNWNmMDY2OThkZNgCBOACAQ&ucfs=1&arphpl=1&checkin=2023-05-04&checkout=2023-05-08&group_adults=2&req_adults=2&no_rooms=1&group_children=0&req_children=0&hpos=16&hapos=66&sr_order=popularity&srpvid=f3a39ec167300007&srepoch=1683153283&all_sr_blocks=795905701_339724704_2_0_0&highlighted_blocks=795905701_339724704_2_0_0&matching_block_id=795905701_339724704_2_0_0&sr_pri_blocks=795905701_339724704_2_0_0__46080&from=searchresults#hotelTmpl
Gorges du Verdon,"Grand gite T5 ""Sirius"" de l'observatoire",3,8.8,757,43.72142017,6.1832723,"Quartier les vallons ndeg491 RD 71, 83630 Bauduen, France","The kitchen comes with a dishwasher, an oven and a microwave, as well as a coffee machine and a kettle. Other facilities at Grand gite T5 ""Sirius"" de l'observatoire include a sun terrace.",https://www.booking.com/hotel/fr/grand-gite-de-l-observatoire.en-gb.html?aid=304142&label=gen173bo-1DCAQoggJCF3NlYXJjaF9nb3JnZXMgZHUgdmVyZG9uSAlYA2hNiAEBmAEJuAEKyAEF2AED6AEB-AEDiAIBmAICqAIDuAKBw8uiBsACAdICJGRjZTEwMzAzLWY2NGYtNDNjNC04MGJmLTJkMjExYjZlYjBhNdgCBOACAQ&ucfs=1&arphpl=1&checkin=2023-05-04&checkout=2023-05-08&group_adults=2&req_adults=2&no_rooms=1&group_children=0&req_children=0&hpos=5&hapos=80&sr_order=popularity&srpvid=3ca69ec0f7100108&srepoch=1683153283&all_sr_blocks=224630301_326762866_2_1_0&highlighted_blocks=224630301_326762866_2_1_0&matching_block_id=224630301_326762866_2_1_0&sr_pri_blocks=224630301_326762866_2_1_0__75704&from=searchresults#hotelTmpl
Gorges du Verdon,La Bonne Etoile - The Good Star,3,8.8,693,43.84759294,6.22231454,"Place Jean-Baptiste Pomey, 04360 Moustiers-Sainte-Marie, France","La Bonne Etoile two apartments are heated and feature a seating area, a washing machine, a tumble dryer, a flat-screen TV with cable channels and a complete bathroom with shower, toilet and hairdryer.",https://www.booking.com/hotel/fr/la-bonne-etoile-moustiers-sainte-marie.en-gb.html?aid=304142&label=gen173bo-1DCAQoggJCF3NlYXJjaF9nb3JnZXMgZHUgdmVyZG9uSAlYA2hNiAEBmAEJuAEKyAEF2AED6AEB-AEDiAIBmAICqAIDuAKEw8uiBsACAdICJDE0YzYzYmRhLTk4N2ItNDE0NC04NmY4LWI0YzkyNDNiYzJjZdgCBOACAQ&ucfs=1&arphpl=1&checkin=2023-05-04&checkout=2023-05-08&group_adults=2&req_adults=2&no_rooms=1&group_children=0&req_children=0&hpos=10&hapos=35&sr_order=popularity&srpvid=11fa9ec2d9d903f3&srepoch=1683153285&all_sr_blocks=81577902_348520317_0_0_0&highlighted_blocks=81577902_348520317_0_0_0&matching_block_id=81577902_348520317_0_0_0&sr_pri_blocks=81577902_348520317_0_0_0__69320&from=searchresults#hotelTmpl
Gorges du Verdon,Le Jas Du Colombier,3,8.8,618,43.83739795,6.21899128,"Le Jas Du Colombier, 04360 Moustiers-Sainte-Marie, France","Le Jas Du Colombier offers 1 villa, 1 apartment and 1 studio, each with a private terrace and views of the surrounding mountains. Entertainment facilities include an LCD TV with a DVD player.",https://www.booking.com/hotel/fr/le-jas-du-comobier.en-gb.html?aid=304142&label=gen173bo-1DCAQoggJCF3NlYXJjaF9nb3JnZXMgZHUgdmVyZG9uSAlYA2hNiAEBmAEJuAEKyAEF2AED6AEB-AEDiAIBmAICqAIDuAKEw8uiBsACAdICJDE0YzYzYmRhLTk4N2ItNDE0NC04NmY4LWI0YzkyNDNiYzJjZdgCBOACAQ&ucfs=1&arphpl=1&checkin=2023-05-04&checkout=2023-05-08&group_adults=2&req_adults=2&no_rooms=1&group_children=0&req_children=0&hpos=21&hapos=46&sr_order=popularity&srpvid=11fa9ec2d9d903f3&srepoch=1683153285&all_sr_blocks=39375006_326753080_2_0_0&highlighted_blocks=39375006_326753080_2_0_0&matching_block_id=39375006_326753080_2_0_0&sr_pri_blocks=39375006_326753080_2_0_0__61820&from=searchresults#hotelTmpl
Gorges du Verdon,La Bastide des Cades,3,8.8,588,43.7625643,6.2416593,"Chemin de l'Estay, Champerlan, 83630 Aiguines, France",A continental breakfast is available daily at the bed and breakfast.,https://www.booking.com/hotel/fr/la-bastide-des-cades-aiguines.en-gb.html?aid=304142&label=gen173nr-1FCAEoggI46AdIM1gEaE2IAQGYAQm4AQrIAQXYAQHoAQH4AQOIAgGoAgO4AsnCy6IGwAIB0gIkZjdhN2UwNzAtMDk0NC00MWE4LWI3MjQtZjYzZDAzMWYyMzAz2AIG4AIB&ucfs=1&arphpl=1&checkin=2023-05-04&checkout=2023-05-08&group_adults=2&req_adults=2&no_rooms=1&group_children=0&req_children=0&hpos=14&hapos=14&sr_order=popularity&srpvid=af409ebd4bf50187&srepoch=1683153276&all_sr_blocks=350507803_340069488_2_1_0&highlighted_blocks=350507803_340069488_2_1_0&matching_block_id=350507803_340069488_2_1_0&sr_pri_blocks=350507803_340069488_2_1_0__58800&from=searchresults#hotelTmpl
Gorges du Verdon,Coté Verdon Plein Sud,3,8.8,454,43.750907,5.874882,"Chemin de la Grande Aubergé, 04800 Gréoux-les-Bains, France","The apartment is equipped with 2 bedrooms, 1 bathroom, bed linen, towels, a flat-screen TV, a dining area, a fully equipped kitchen, and a terrace with mountain views.",https://www.booking.com/hotel/fr/cote-verdon-greoux-les-bains.en-gb.html?aid=304142&label=gen173bo-1DCAQoggJCF3NlYXJjaF9nb3JnZXMgZHUgdmVyZG9uSAlYA2hNiAEBmAEJuAEKyAEF2AED6AEB-AEDiAIBmAICqAIDuAKCw8uiBsACAdICJGEyOTFlMGQ3LTgzOTctNGEzMy04YTJlLTMwNWNmMDY2OThkZNgCBOACAQ&ucfs=1&arphpl=1&checkin=2023-05-04&checkout=2023-05-08&group_adults=2&req_adults=2&no_rooms=1&group_children=0&req_children=0&hpos=11&hapos=61&sr_order=popularity&srpvid=f3a39ec167300007&srepoch=1683153283&all_sr_blocks=764795401_367035320_2_0_0&highlighted_blocks=764795401_367035320_2_0_0&matching_block_id=764795401_367035320_2_0_0&sr_pri_blocks=764795401_367035320_2_0_0__45360&from_sustainable_property_sr=1&from=searchresults#hotelTmpl
