city,hotel_names,stars,rating,price,hotel_lat,hotel_lon,adresses,descriptions,link
Aigues Mortes,L'Aube Ensoleillée entre Plage et Pinède,4,10.0,500,43.5505113,4.1259703,"1140 Avenue de la Pinède Résidence L'Aube, 30240 Le Grau-du-Roi, France","The apartment has 2 bedrooms, a kitchen with fridge and oven, and 1 bathroom with a shower, a hairdryer and a washing machine. A TV is offered.",https://www.booking.com/hotel/fr/sunny-dawn.en-gb.html?aid=304142&label=gen173bo-1DCAQoggJCFHNlYXJjaF9haWd1ZXMgbW9ydGVzSAlYA2hNiAEBmAEJuAEKyAEF2AED6AEB-AEDiAIBmAICqAIDuAL0wsuiBsACAdICJDU3ZmUxYTBjLTA5ZDEtNGE5My1hZWQ1LWJiNzdjZDhmMjJjZNgCBOACAQ&ucfs=1&arphpl=1&checkin=2023-05-04&checkout=2023-05-08&group_adults=2&req_adults=2&no_rooms=1&group_children=0&req_children=0&hpos=22&hapos=47&sr_order=popularity&srpvid=e05b9ebaed47027b&srepoch=1683153269&all_sr_blocks=954231202_367946940_4_0_0&highlighted_blocks=954231202_367946940_4_0_0&matching_block_id=954231202_367946940_4_0_0&sr_pri_blocks=954231202_367946940_4_0_0__49952&from=searchresults#hotelTmpl
Aigues Mortes,Marcelle en Camargue,4,9.9,858,43.5661556,4.192345,"40 Rue Pasteur, 30220 Aigues-Mortes, France","At the guest house, rooms are equipped with a desk, bed linen and a patio with pool view. With a private bathroom fitted with a shower and free toiletries, rooms at Marcelle en Camargue also boast free WiFi, while some rooms have a city view. At the accommodation, every room is equipped with air conditioning and a safety deposit box.",https://www.booking.com/hotel/fr/marcelle-en-camargue.en-gb.html?aid=304142&label=gen173nr-1FCAEoggI46AdIM1gEaE2IAQGYAQm4AQrIAQXYAQHoAQH4AQOIAgGoAgO4AsnCy6IGwAIB0gIkZjdhN2UwNzAtMDk0NC00MWE4LWI3MjQtZjYzZDAzMWYyMzAz2AIG4AIB&ucfs=1&arphpl=1&checkin=2023-05-04&checkout=2023-05-08&group_adults=2&req_adults=2&no_rooms=1&group_children=0&req_children=0&hpos=19&hapos=19&sr_order=popularity&srpvid=8db69ea94009051b&srepoch=1683153237&all_sr_blocks=882209702_357524645_2_1_0&highlighted_blocks=882209702_357524645_2_1_0&matching_block_id=882209702_357524645_2_1_0&sr_pri_blocks=882209702_357524645_2_1_0__85787&from_sustainable_property_sr=1&from=searchresults#hotelTmpl
Aigues Mortes,Mazet du pêcheur,4,9.7,1453,43.5719752,4.2202027,"Les Courèges, 30220 Saint-Laurent-dʼAigouze, France","This holiday home is fitted with 3 bedrooms, a kitchen with a fridge and an oven, a flat-screen TV, a seating area and 2 bathrooms fitted with a shower. Towels and bed linen are offered in the holiday home.",https://www.booking.com/hotel/fr/mazet-du-pecheur.en-gb.html?aid=304142&label=gen173nr-1FCAEoggI46AdIM1gEaE2IAQGYAQm4AQrIAQXYAQHoAQH4AQOIAgGoAgO4AsnCy6IGwAIB0gIkZjdhN2UwNzAtMDk0NC00MWE4LWI3MjQtZjYzZDAzMWYyMzAz2AIG4AIB&ucfs=1&arphpl=1&checkin=2023-05-04&checkout=2023-05-08&group_adults=2&req_adults=2&no_rooms=1&group_children=0&req_children=0&hpos=22&hapos=22&sr_order=popularity&srpvid=8db69ea94009051b&srepoch=1683153237&all_sr_blocks=897261201_369639574_4_0_0&highlighted_blocks=897261201_369639574_4_0_0&matching_block_id=897261201_369639574_4_0_0&sr_pri_blocks=897261201_369639574_4_0_0__145292&from=searchresults#hotelTmpl
Aigues Mortes,Boutique Hôtel des Remparts & Spa,5,9.5,1943,43.56803552,4.1903438,"6, Place Anatole France, 30220 Aigues-Mortes, France","Located in a former military station dating from the 18th-century, inside the medieval ramparts of Aigues-Mortes, this refined hotel offers a bar and a terrace with sun loungers. There is also a spa with an indoor heated pool. This boutique hotel is located opposite the Tower of Constance and The Centre for National Monuments.",https://www.booking.com/hotel/fr/les-remparts-aigues-mortes.en-gb.html?aid=304142&label=gen173nr-1FCAEoggI46AdIM1gEaE2IAQGYAQm4AQrIAQXYAQHoAQH4AQOIAgGoAgO4AsnCy6IGwAIB0gIkZjdhN2UwNzAtMDk0NC00MWE4LWI3MjQtZjYzZDAzMWYyMzAz2AIG4AIB&ucfs=1&arphpl=1&checkin=2023-05-04&checkout=2023-05-08&group_adults=2&req_adults=2&no_rooms=1&group_children=0&req_children=0&hpos=12&hapos=12&sr_order=popularity&srpvid=8db69ea94009051b&srepoch=1683153237&all_sr_blocks=32340507_92135418_0_2_0&highlighted_blocks=32340507_92135418_0_2_0&matching_block_id=32340507_92135418_0_2_0&sr_pri_blocks=32340507_92135418_0_2_0__194260&from_sustainable_property_sr=1&from=searchresults#hotelTmpl
Aigues Mortes,Maison Diderot,3,9.5,954,43.5676366,4.1924715,"7 Boulevard Diderot, 30220 Aigues-Mortes, France","This holiday home is fitted with 4 bedrooms, a kitchen with a fridge and an oven, a flat-screen TV, a seating area and 2 bathrooms fitted with a bath or shower. Towels and bed linen are offered in the holiday home.",https://www.booking.com/hotel/fr/maison-diderot-aigues-mortes2.en-gb.html?aid=304142&label=gen173nr-1FCAEoggI46AdIM1gEaE2IAQGYAQm4AQrIAQXYAQHoAQH4AQOIAgGoAgO4AsnCy6IGwAIB0gIkZjdhN2UwNzAtMDk0NC00MWE4LWI3MjQtZjYzZDAzMWYyMzAz2AIG4AIB&ucfs=1&arphpl=1&checkin=2023-05-04&checkout=2023-05-08&group_adults=2&req_adults=2&no_rooms=1&group_children=0&req_children=0&hpos=2&hapos=2&sr_order=popularity&srpvid=8db69ea94009051b&srepoch=1683153237&all_sr_blocks=974779401_369859505_8_0_0&highlighted_blocks=974779401_369859505_8_0_0&matching_block_id=974779401_369859505_8_0_0&sr_pri_blocks=974779401_369859505_8_0_0__95380&from=searchresults#hotelTmpl
Aigues Mortes,Maison d'Hôtes Mas de Barbut,4,9.5,680,43.62323536,4.18014228,"Chemin de la Carrière Neuve, 30220 Saint-Laurent-dʼAigouze, France",Each room has a private bathroom with a hairdryer and free toiletries. The rooms are equipped with a kettle and courtesy tray and certain rooms have a private terrace. A TV is available upon request.,https://www.booking.com/hotel/fr/maison-d-ha-tes-mas-de-barbut.en-gb.html?aid=304142&label=gen173bo-1DCAQoggJCFHNlYXJjaF9haWd1ZXMgbW9ydGVzSAlYA2hNiAEBmAEJuAEKyAEF2AED6AEB-AEDiAIBmAICqAIDuALhwsuiBsACAdICJDE0OTk1ZTIxLTRjM2MtNGU1MC1hYjBjLTRkOTdiNmIzYjY1N9gCBOACAQ&ucfs=1&arphpl=1&checkin=2023-05-04&checkout=2023-05-08&group_adults=2&req_adults=2&no_rooms=1&group_children=0&req_children=0&hpos=10&hapos=85&sr_order=popularity&srpvid=8aaf9eb09f31026c&srepoch=1683153250&all_sr_blocks=50669703_325531831_0_1_0&highlighted_blocks=50669703_325531831_0_1_0&matching_block_id=50669703_325531831_0_1_0&sr_pri_blocks=50669703_325531831_0_1_0__68000&from=searchresults#hotelTmpl
Aigues Mortes,B&B La Terre Brûlée,3,9.2,608,43.56197612,4.20767969,"913 Chemin D'esparron, 30220 Aigues-Mortes, France","There is a private bathroom with shower in all units, along with free toiletries and a hairdryer.",https://www.booking.com/hotel/fr/b-amp-b-la-terre-brulee.en-gb.html?aid=304142&label=gen173nr-1FCAEoggI46AdIM1gEaE2IAQGYAQm4AQrIAQXYAQHoAQH4AQOIAgGoAgO4AsnCy6IGwAIB0gIkZjdhN2UwNzAtMDk0NC00MWE4LWI3MjQtZjYzZDAzMWYyMzAz2AIG4AIB&ucfs=1&arphpl=1&checkin=2023-05-04&checkout=2023-05-08&group_adults=2&req_adults=2&no_rooms=1&group_children=0&req_children=0&hpos=10&hapos=10&sr_order=popularity&srpvid=8db69ea94009051b&srepoch=1683153237&all_sr_blocks=168292201_326760102_2_1_0&highlighted_blocks=168292201_326760102_2_1_0&matching_block_id=168292201_326760102_2_1_0&sr_pri_blocks=168292201_326760102_2_1_0__60800&from=searchresults#hotelTmpl
Aigues Mortes,La Villa Mazarin,5,9.1,1353,43.56498662,4.19175196,"35 boulevard Gambetta, 30220 Aigues-Mortes, France","Set in a building dating from the 15th century, La Villa Mazarin is located in the fortified city of Aigues-Mortes. It offers a terrace and guests can enjoy a drink at the bar. Free WiFi is available throughout.",https://www.booking.com/hotel/fr/la-villa-mazarin.en-gb.html?aid=304142&label=gen173nr-1FCAEoggI46AdIM1gEaE2IAQGYAQm4AQrIAQXYAQHoAQH4AQOIAgGoAgO4AsnCy6IGwAIB0gIkZjdhN2UwNzAtMDk0NC00MWE4LWI3MjQtZjYzZDAzMWYyMzAz2AIG4AIB&ucfs=1&arphpl=1&checkin=2023-05-04&checkout=2023-05-08&group_adults=2&req_adults=2&no_rooms=1&group_children=0&req_children=0&hpos=8&hapos=8&sr_order=popularity&srpvid=8db69ea94009051b&srepoch=1683153237&all_sr_blocks=5352120_99734949_0_42_0&highlighted_blocks=5352120_99734949_0_42_0&matching_block_id=5352120_99734949_0_42_0&sr_pri_blocks=5352120_99734949_0_42_0__135260&from=searchresults#hotelTmpl
Aigues Mortes,Mas de la Montille,3,9.1,564,43.58386486,4.23920989,"Route des Saintes Marie de la Mer , 30220 Aigues-Mortes, France","The Mas de la Montille is located in Aigues Mortes, 6.2 miles from Espiguette Beach.  It features a seasonal swimming pool and an orchard in its garden and you can relax in the hot tub.",https://www.booking.com/hotel/fr/mas-de-la-montille.en-gb.html?aid=304142&label=gen173nr-1FCAEoggI46AdIM1gEaE2IAQGYAQm4AQrIAQXYAQHoAQH4AQOIAgGoAgO4AsnCy6IGwAIB0gIkZjdhN2UwNzAtMDk0NC00MWE4LWI3MjQtZjYzZDAzMWYyMzAz2AIG4AIB&ucfs=1&arphpl=1&checkin=2023-05-04&checkout=2023-05-08&group_adults=2&req_adults=2&no_rooms=1&group_children=0&req_children=0&hpos=11&hapos=11&sr_order=popularity&srpvid=8db69ea94009051b&srepoch=1683153237&all_sr_blocks=40078901_310847868_0_42_0&highlighted_blocks=40078901_310847868_0_42_0&matching_block_id=40078901_310847868_0_42_0&sr_pri_blocks=40078901_310847868_0_42_0__56400&from_sustainable_property_sr=1&from=searchresults#hotelTmpl
Aigues Mortes,Villa de plein pied - 82 m²,3,9.0,756,43.5480779,4.1315099,"394 Rue des Flamboyants, 30240 Le Grau-du-Roi, France","The air-conditioned villa consists of 2 bedrooms, a living room, a fully equipped kitchen with a fridge and a coffee machine, and 1 bathroom with a bidet and a shower. For added convenience, the property can provide towels and bed linen for an extra charge.",https://www.booking.com/hotel/fr/villa-de-plein-pied-82-m2.en-gb.html?aid=304142&label=gen173bo-1DCAQoggJCFHNlYXJjaF9haWd1ZXMgbW9ydGVzSAlYA2hNiAEBmAEJuAEKyAEF2AED6AEB-AEDiAIBmAICqAIDuALzwsuiBsACAdICJDljNjMzNjVjLTEwZjQtNGIzYS04ZjFjLTJkODY0OTkwYzRlYdgCBOACAQ&ucfs=1&arphpl=1&checkin=2023-05-04&checkout=2023-05-08&group_adults=2&req_adults=2&no_rooms=1&group_children=0&req_children=0&hpos=21&hapos=71&sr_order=popularity&srpvid=d59b9eb9607600f4&srepoch=1683153269&all_sr_blocks=881904101_359978635_5_0_0&highlighted_blocks=881904101_359978635_5_0_0&matching_block_id=881904101_359978635_5_0_0&sr_pri_blocks=881904101_359978635_5_0_0__75640&from=searchresults#hotelTmpl
Aigues Mortes,Chambre d'hôte Farniente,3,9.0,356,43.56761513,4.19335402,"10 Rue des Travailleurs, 30220 Aigues-Mortes, France",A continental breakfast is available each morning at the bed and breakfast.,https://www.booking.com/hotel/fr/chambre-d-39-hote-farniente.en-gb.html?aid=304142&label=gen173nr-1FCAEoggI46AdIM1gEaE2IAQGYAQm4AQrIAQXYAQHoAQH4AQOIAgGoAgO4AsnCy6IGwAIB0gIkZjdhN2UwNzAtMDk0NC00MWE4LWI3MjQtZjYzZDAzMWYyMzAz2AIG4AIB&ucfs=1&arphpl=1&checkin=2023-05-04&checkout=2023-05-08&group_adults=2&req_adults=2&no_rooms=1&group_children=0&req_children=0&hpos=6&hapos=6&sr_order=popularity&srpvid=8db69ea94009051b&srepoch=1683153237&all_sr_blocks=744732303_330277623_2_1_0&highlighted_blocks=744732303_330277623_2_1_0&matching_block_id=744732303_330277623_2_1_0&sr_pri_blocks=744732303_330277623_2_1_0__35564&from=searchresults#hotelTmpl
Aigues Mortes,Appartement 2 chambres proche plage Suzanne 2,3,8.8,528,43.5313397,4.1455313,"105 Rue du Vaccares, 30240 Le Grau-du-Roi, France","The air-conditioned apartment is composed of 2 separate bedrooms, a living room, a fully equipped kitchen with a fridge and oven, and 1 bathroom. For added convenience, the property can provide towels and bed linen for an extra charge.",https://www.booking.com/hotel/fr/appartement-2-chambres-proche-plage-le-grau-du-roi.en-gb.html?aid=304142&label=gen173bo-1DCAQoggJCFHNlYXJjaF9haWd1ZXMgbW9ydGVzSAlYA2hNiAEBmAEJuAEKyAEF2AED6AEB-AEDiAIBmAICqAIDuAL0wsuiBsACAdICJDU3ZmUxYTBjLTA5ZDEtNGE5My1hZWQ1LWJiNzdjZDhmMjJjZNgCBOACAQ&ucfs=1&arphpl=1&checkin=2023-05-04&checkout=2023-05-08&group_adults=2&req_adults=2&no_rooms=1&group_children=0&req_children=0&hpos=21&hapos=46&sr_order=popularity&srpvid=e05b9ebaed47027b&srepoch=1683153269&all_sr_blocks=713377301_298307913_5_0_0&highlighted_blocks=713377301_298307913_5_0_0&matching_block_id=713377301_298307913_5_0_0&sr_pri_blocks=713377301_298307913_5_0_0__52760&from=searchresults#hotelTmpl
Aigues Mortes,"T2 cosy de 41m2 à 400 m de la plage, résidence avec piscine.",3,8.8,430,43.52923187,4.14860849,"Résidence les Floralies 2 964 avenue de Camargue, 30240 Le Grau-du-Roi, France","Located in Le Grau-du-Roi, 0.7 miles from North Beach and 1.2 miles from Rive Droite, T2 cosy de 41m2 à 450 yards de la plage, résidence avec piscine. Provides accommodation with amenities such as free WiFi and a flat-screen TV. Set less than 0.6 miles from Rive Gauche Beach, the property offers a seasonal outdoor swimming pool and free private parking.",https://www.booking.com/hotel/fr/t2-cosy-de-41m2-a-400-m-de-la-plage-residence-avec-piscine.en-gb.html?aid=304142&label=gen173bo-1DCAQoggJCFHNlYXJjaF9haWd1ZXMgbW9ydGVzSAlYA2hNiAEBmAEJuAEKyAEF2AED6AEB-AEDiAIBmAICqAIDuAL0wsuiBsACAdICJDU3ZmUxYTBjLTA5ZDEtNGE5My1hZWQ1LWJiNzdjZDhmMjJjZNgCBOACAQ&ucfs=1&arphpl=1&checkin=2023-05-04&checkout=2023-05-08&group_adults=2&req_adults=2&no_rooms=1&group_children=0&req_children=0&hpos=17&hapos=42&sr_order=popularity&srpvid=e05b9ebaed47027b&srepoch=1683153269&all_sr_blocks=381195601_122249988_4_0_0&highlighted_blocks=381195601_122249988_4_0_0&matching_block_id=381195601_122249988_4_0_0&sr_pri_blocks=381195601_122249988_4_0_0__43000&from=searchresults#hotelTmpl
Aigues Mortes,Hotel Les Templiers,3,8.6,728,43.56694565,4.19187346,"21 Et 23 Rue De La Republique, 30220 Aigues-Mortes, France",Guests of the Hotel Les Templiers can enjoy a continental breakfast every morning. There is also a bar and a garden. Free Wi-Fi access is available in the hotel’s 24-hour reception.,https://www.booking.com/hotel/fr/les-templiers.en-gb.html?aid=304142&label=gen173nr-1FCAEoggI46AdIM1gEaE2IAQGYAQm4AQrIAQXYAQHoAQH4AQOIAgGoAgO4AsnCy6IGwAIB0gIkZjdhN2UwNzAtMDk0NC00MWE4LWI3MjQtZjYzZDAzMWYyMzAz2AIG4AIB&ucfs=1&arphpl=1&checkin=2023-05-04&checkout=2023-05-08&group_adults=2&req_adults=2&no_rooms=1&group_children=0&req_children=0&hpos=20&hapos=20&sr_order=popularity&srpvid=8db69ea94009051b&srepoch=1683153237&all_sr_blocks=5876601_340055943_0_2_0&highlighted_blocks=5876601_340055943_0_2_0&matching_block_id=5876601_340055943_0_2_0&sr_pri_blocks=5876601_340055943_0_2_0__72800&from_sustainable_property_sr=1&from=searchresults#hotelTmpl
Aigues Mortes,Hôtel Le Médiéval,2,8.6,618,43.57186625,4.19366169,"221 Avenue Du Pont De Provence, 30220 Aigues-Mortes, France","Le Médiéval is located on the banks of the canal in Aigues-Mortes, 18.6 miles from Montpellier. It offers en suite rooms, free parking and an outdoor swimming pool.",https://www.booking.com/hotel/fr/le-medieval.en-gb.html?aid=304142&label=gen173nr-1FCAEoggI46AdIM1gEaE2IAQGYAQm4AQrIAQXYAQHoAQH4AQOIAgGoAgO4AsnCy6IGwAIB0gIkZjdhN2UwNzAtMDk0NC00MWE4LWI3MjQtZjYzZDAzMWYyMzAz2AIG4AIB&ucfs=1&arphpl=1&checkin=2023-05-04&checkout=2023-05-08&group_adults=2&req_adults=2&no_rooms=1&group_children=0&req_children=0&hpos=4&hapos=4&sr_order=popularity&srpvid=8db69ea94009051b&srepoch=1683153237&all_sr_blocks=25855904_360122595_3_2_0&highlighted_blocks=25855904_360122595_3_2_0&matching_block_id=25855904_360122595_3_2_0&sr_pri_blocks=25855904_360122595_3_2_0__61800&from_sustainable_property_sr=1&from=searchresults#hotelTmpl
Aigues Mortes,Villa Tramontane,4,8.5,1436,43.5386916,4.1340242,"3 Rue du Pounent, 30240 Le Grau-du-Roi, France","Set in Le Grau-du-Roi, less than 0.6 miles from Rive Gauche Beach and a 13-minute walk from Boucanet, Villa Tramontane provides accommodation with amenities such as free WiFi and a flat-screen TV. Situated 100 yards from Rive Droite, the property features a terrace and free private parking.",https://www.booking.com/hotel/fr/villa-tramontane.en-gb.html?aid=304142&label=gen173bo-1DCAQoggJCFHNlYXJjaF9haWd1ZXMgbW9ydGVzSAlYA2hNiAEBmAEJuAEKyAEF2AED6AEB-AEDiAIBmAICqAIDuALzwsuiBsACAdICJDljNjMzNjVjLTEwZjQtNGIzYS04ZjFjLTJkODY0OTkwYzRlYdgCBOACAQ&ucfs=1&arphpl=1&checkin=2023-05-04&checkout=2023-05-08&group_adults=2&req_adults=2&no_rooms=1&group_children=0&req_children=0&hpos=25&hapos=75&sr_order=popularity&srpvid=d59b9eb9607600f4&srepoch=1683153269&all_sr_blocks=379546701_147055102_8_0_0&highlighted_blocks=379546701_147055102_8_0_0&matching_block_id=379546701_147055102_8_0_0&sr_pri_blocks=379546701_147055102_8_0_0__143640&from=searchresults#hotelTmpl
Aigues Mortes,Hotel Canal Aigues Mortes,3,8.5,491,43.57298752,4.1948247,"440 Route De Nimes, 30220 Aigues-Mortes, France","Hotel Canal Aigues Mortes is a 5-minute walk to the fortified city, on the banks of the canal, visible from its panoramic terrace and swimming pool. It offers air-conditioned rooms with free WiFi. Free parking is available and garage parking is possible for an extra charge, or free of charge for motorbikes.",https://www.booking.com/hotel/fr/canal-aigues-mortes.en-gb.html?aid=304142&label=gen173nr-1FCAEoggI46AdIM1gEaE2IAQGYAQm4AQrIAQXYAQHoAQH4AQOIAgGoAgO4AsnCy6IGwAIB0gIkZjdhN2UwNzAtMDk0NC00MWE4LWI3MjQtZjYzZDAzMWYyMzAz2AIG4AIB&ucfs=1&arphpl=1&checkin=2023-05-04&checkout=2023-05-08&group_adults=2&req_adults=2&no_rooms=1&group_children=0&req_children=0&hpos=1&hapos=1&sr_order=popularity&srpvid=8db69ea94009051b&srepoch=1683153237&all_sr_blocks=5438602_199316338_0_2_0&highlighted_blocks=5438602_199316338_0_2_0&matching_block_id=5438602_199316338_0_2_0&sr_pri_blocks=5438602_199316338_0_2_0__49080&from_sustainable_property_sr=1&from=searchresults#hotelTmpl
Aigues Mortes,CAP sur LA MEDITERRANEE 2,3,8.5,447,43.5178813,4.1482975,"55 rue du taillevent, 30240 Le Grau-du-Roi, France","The air-conditioned apartment consists of 1 bedroom, a living room, a fully equipped kitchen with a fridge and a coffee machine, and 1 bathroom with a shower. A TV is available.",https://www.booking.com/hotel/fr/cap-sur-la-mediterranee-2.en-gb.html?aid=304142&label=gen173bo-1DCAQoggJCFHNlYXJjaF9haWd1ZXMgbW9ydGVzSAlYA2hNiAEBmAEJuAEKyAEF2AED6AEB-AEDiAIBmAICqAIDuALhwsuiBsACAdICJDE0OTk1ZTIxLTRjM2MtNGU1MC1hYjBjLTRkOTdiNmIzYjY1N9gCBOACAQ&ucfs=1&arphpl=1&checkin=2023-05-04&checkout=2023-05-08&group_adults=2&req_adults=2&no_rooms=1&group_children=0&req_children=0&hpos=15&hapos=90&sr_order=popularity&srpvid=8aaf9eb09f31026c&srepoch=1683153250&all_sr_blocks=880237702_357209329_4_0_0&highlighted_blocks=880237702_357209329_4_0_0&matching_block_id=880237702_357209329_4_0_0&sr_pri_blocks=880237702_357209329_4_0_0__44700&from=searchresults#hotelTmpl
Aigues Mortes,T2 avec Jardin Proche Plage Camargue Village F,3,8.5,445,43.54996897,4.12335395,"Résidence Camargue Village - Entrée Batiment TRIGNOULET 1450 Avenue de la Pinède, 30240 Le Grau-du-Roi, France","The apartment with a terrace and garden views features 1 bedroom, a living room, a flat-screen TV, an equipped kitchen with a fridge and a microwave, and 1 bathroom with a bath. For added convenience, the property can provide towels and bed linen for an extra charge.",https://www.booking.com/hotel/fr/t2-avec-jardin-proche-plage-camargue-village-f.en-gb.html?aid=304142&label=gen173bo-1DCAQoggJCFHNlYXJjaF9haWd1ZXMgbW9ydGVzSAlYA2hNiAEBmAEJuAEKyAEF2AED6AEB-AEDiAIBmAICqAIDuALzwsuiBsACAdICJDljNjMzNjVjLTEwZjQtNGIzYS04ZjFjLTJkODY0OTkwYzRlYdgCBOACAQ&ucfs=1&arphpl=1&checkin=2023-05-04&checkout=2023-05-08&group_adults=2&req_adults=2&no_rooms=1&group_children=0&req_children=0&hpos=13&hapos=63&sr_order=popularity&srpvid=d59b9eb9607600f4&srepoch=1683153269&all_sr_blocks=668277601_275786042_4_0_0&highlighted_blocks=668277601_275786042_4_0_0&matching_block_id=668277601_275786042_4_0_0&sr_pri_blocks=668277601_275786042_4_0_0__44496&from=searchresults#hotelTmpl
Aigues Mortes,Hôtel Saint Louis,3,8.4,681,43.56721967,4.1893436,"10, Rue Amiral Courbet, 30220 Aigues-Mortes, France","Set in the historical heart of Aigues-Mortes, 200 yards from the Tour de Constance, Hôtel Saint Louis is an air-conditioned hotel with a wellness center and restaurant. Free WiFi access is available on site and public city parking spots are available for free.",https://www.booking.com/hotel/fr/saint-louis-aigues-mortes.en-gb.html?aid=304142&label=gen173nr-1FCAEoggI46AdIM1gEaE2IAQGYAQm4AQrIAQXYAQHoAQH4AQOIAgGoAgO4AsnCy6IGwAIB0gIkZjdhN2UwNzAtMDk0NC00MWE4LWI3MjQtZjYzZDAzMWYyMzAz2AIG4AIB&ucfs=1&arphpl=1&checkin=2023-05-04&checkout=2023-05-08&group_adults=2&req_adults=2&no_rooms=1&group_children=0&req_children=0&hpos=3&hapos=3&sr_order=popularity&srpvid=8db69ea94009051b&srepoch=1683153237&all_sr_blocks=7675805_334433274_0_34_0&highlighted_blocks=7675805_334433274_0_34_0&matching_block_id=7675805_334433274_0_34_0&sr_pri_blocks=7675805_334433274_0_34_0__68080&from_sustainable_property_sr=1&from=searchresults#hotelTmpl
Aix en Provence,Pavillon de Beauregard,3,9.5,1047,43.5445128,5.4681052,"1541 chemin de Beauregard, 13100 Aix-en-Provence, France","Offering an outdoor pool and a garden, Pavillon de Beauregard is a Bed and Breakfast located 2.1 miles from Aix-en-Provence. Free WiFi access is available in all rooms.",https://www.booking.com/hotel/fr/pavillon-de-beauregard.en-gb.html?aid=304142&label=gen173nr-1FCAEoggI46AdIM1gEaE2IAQGYAQm4AQrIAQXYAQHoAQH4AQOIAgGoAgO4AsnCy6IGwAIB0gIkZjdhN2UwNzAtMDk0NC00MWE4LWI3MjQtZjYzZDAzMWYyMzAz2AIG4AIB&ucfs=1&arphpl=1&checkin=2023-05-04&checkout=2023-05-08&group_adults=2&req_adults=2&no_rooms=1&group_children=0&req_children=0&hpos=19&hapos=19&sr_order=popularity&srpvid=b3c99eabd5d90133&srepoch=1683153240&all_sr_blocks=106143103_261429590_3_1_0&highlighted_blocks=106143103_261429590_3_1_0&matching_block_id=106143103_261429590_3_1_0&sr_pri_blocks=106143103_261429590_3_1_0__104680&from=searchresults#hotelTmpl
Aix en Provence,Château de la Gaude,5,9.0,3586,43.56879,5.47851,"3959 route des Pinchinats, 13100 Aix-en-Provence, France","The hotel will provide guests with air-conditioned rooms with a wardrobe, a coffee machine, a minibar, a safety deposit box, a flat-screen TV and a private bathroom with a shower. At Château de la Gaude all rooms come with bed linen and towels.",https://www.booking.com/hotel/fr/chateau-de-la-gaude.en-gb.html?aid=304142&label=gen173bo-1DCAQoggJCFnNlYXJjaF9haXggZW4gcHJvdmVuY2VICVgDaE2IAQGYAQm4AQrIAQXYAQPoAQH4AQOIAgGYAgKoAgO4AvPCy6IGwAIB0gIkY2YwYTJiNWItZjRiMC00YzdmLTkzYmMtNzU5NTliYWM0ZjVl2AIE4AIB&ucfs=1&arphpl=1&checkin=2023-05-04&checkout=2023-05-08&group_adults=2&req_adults=2&no_rooms=1&group_children=0&req_children=0&hpos=1&hapos=26&sr_order=popularity&srpvid=30859eb95d9b0153&srepoch=1683153268&all_sr_blocks=513919404_295258756_2_2_0&highlighted_blocks=513919404_295258756_2_2_0&matching_block_id=513919404_295258756_2_2_0&sr_pri_blocks=513919404_295258756_2_2_0__358640&from=searchresults#hotelTmpl
Aix en Provence,"la Colinière, joli studio en pleine nature",3,9.0,420,43.61781771,5.44888895,"7550 Route du Puy Sainte-Réparade, 13540 Aix-en-Provence, France","The apartment is fitted with a flat-screen TV. The kitchen comes with a fridge, an oven and a dishwasher, as well as coffee machine and kettle.",https://www.booking.com/hotel/fr/joli-studio-en-pleine-nature.en-gb.html?aid=304142&label=gen173bo-1DCAQoggJCFnNlYXJjaF9haXggZW4gcHJvdmVuY2VICVgDaE2IAQGYAQm4AQrIAQXYAQPoAQH4AQOIAgGYAgKoAgO4AvPCy6IGwAIB0gIkY2YwYTJiNWItZjRiMC00YzdmLTkzYmMtNzU5NTliYWM0ZjVl2AIE4AIB&ucfs=1&arphpl=1&checkin=2023-05-04&checkout=2023-05-08&group_adults=2&req_adults=2&no_rooms=1&group_children=0&req_children=0&hpos=3&hapos=28&sr_order=popularity&srpvid=30859eb95d9b0153&srepoch=1683153268&all_sr_blocks=870081901_355651429_2_0_0&highlighted_blocks=870081901_355651429_2_0_0&matching_block_id=870081901_355651429_2_0_0&sr_pri_blocks=870081901_355651429_2_0_0__42000&from=searchresults#hotelTmpl
Aix en Provence,Les Lodges Sainte-Victoire Hotel & Spa,5,8.9,2363,43.5211698,5.49659729,"2250 ROUTE CEZANNE, 13100 Aix-en-Provence, France","Set in 5-hectare park with vineyards and Olive trees, Les Lodges Sainte-Victoire is a hotel decorated in an elegant style. The property was built in the 18th property and includes spa facilities as well as 2 swimming pools.",https://www.booking.com/hotel/fr/les-lodges-sainte-victoire.en-gb.html?aid=304142&label=gen173nr-1FCAEoggI46AdIM1gEaE2IAQGYAQm4AQrIAQXYAQHoAQH4AQOIAgGoAgO4AsnCy6IGwAIB0gIkZjdhN2UwNzAtMDk0NC00MWE4LWI3MjQtZjYzZDAzMWYyMzAz2AIG4AIB&ucfs=1&arphpl=1&checkin=2023-05-04&checkout=2023-05-08&group_adults=2&req_adults=2&no_rooms=1&group_children=0&req_children=0&hpos=22&hapos=22&sr_order=popularity&srpvid=b3c99eabd5d90133&srepoch=1683153240&all_sr_blocks=55834301_370052904_2_2_0&highlighted_blocks=55834301_370052904_2_2_0&matching_block_id=55834301_370052904_2_2_0&sr_pri_blocks=55834301_370052904_2_2_0__236316&from_sustainable_property_sr=1&from=searchresults#hotelTmpl
Aix en Provence,Aquabella Hôtel & Spa,4,8.4,1102,43.5312636,5.44507004,"2, Rue des Etuves, 13100 Aix-en-Provence, France",The guest rooms at the Aquabella are all air-conditioned and equipped with free Wi-Fi access and mini-bars. Bathrobes are also provided.,https://www.booking.com/hotel/fr/hotel-aquabella.en-gb.html?aid=304142&label=gen173nr-1FCAEoggI46AdIM1gEaE2IAQGYAQm4AQrIAQXYAQHoAQH4AQOIAgGoAgO4AsnCy6IGwAIB0gIkZjdhN2UwNzAtMDk0NC00MWE4LWI3MjQtZjYzZDAzMWYyMzAz2AIG4AIB&ucfs=1&arphpl=1&checkin=2023-05-04&checkout=2023-05-08&group_adults=2&req_adults=2&no_rooms=1&group_children=0&req_children=0&hpos=10&hapos=10&sr_order=popularity&srpvid=b3c99eabd5d90133&srepoch=1683153240&all_sr_blocks=78419_160330670_0_34_0&highlighted_blocks=78419_160330670_0_34_0&matching_block_id=78419_160330670_0_34_0&sr_pri_blocks=78419_160330670_0_34_0__110216&from_sustainable_property_sr=1&from=searchresults#hotelTmpl
