city,hotel_names,stars,rating,price,hotel_lat,hotel_lon,adresses,descriptions,link
Mont Saint Michel,Ker-Loën,3,8.9,480,48.46269895,-1.47911221,"1, rue de Saint Ouen  - Antrain, 35560  Antrain, France","Ker-Loën is located in Antrain, 14.3 miles from Mont Saint Michel and 16.2 miles from Fougères. It offers an outdoor, covered swimming pool and a terrace.",https://www.booking.com/hotel/fr/la-demeure-d-isaure.en-gb.html?aid=304142&label=gen173bo-1DCAQoggJCGHNlYXJjaF9tb250IHNhaW50IG1pY2hlbEgJWANoTYgBAZgBCbgBCsgBBdgBA-gBAfgBA4gCAZgCAqgCA7gCicPLogbAAgHSAiQwNmNmMTJiNC1jOTJiLTQ1YmYtODA5Yi04MTg1NWI4YzdkNGHYAgTgAgE&ucfs=1&arphpl=1&checkin=2023-05-04&checkout=2023-05-08&group_adults=2&req_adults=2&no_rooms=1&group_children=0&req_children=0&hpos=6&hapos=31&sr_order=popularity&srpvid=7f379ec4416901e7&srepoch=1683153290&all_sr_blocks=44176506_365435103_2_41_0&highlighted_blocks=44176506_365435103_2_41_0&matching_block_id=44176506_365435103_2_41_0&sr_pri_blocks=44176506_365435103_2_41_0__48040&from_sustainable_property_sr=1&from=searchresults#hotelTmpl
Mont Saint Michel,La Ramade,4,8.8,756,48.6936516,-1.37474477,"2 Rue De La Côte Marcey les grèves, 50300 Avranches, France",All rooms at La Ramade are soundproofed. One of the villas has rooms with romantic feel and are decorated in a flower theme while the other offers contemporary-style rooms. Most rooms have views of the gardens or surrounding countryside and some are serviced by a lift.,https://www.booking.com/hotel/fr/la-ramade.en-gb.html?aid=304142&label=gen173nr-1FCAEoggI46AdIM1gEaE2IAQGYAQm4AQrIAQXYAQHoAQH4AQOIAgGoAgO4AsnCy6IGwAIB0gIkZjdhN2UwNzAtMDk0NC00MWE4LWI3MjQtZjYzZDAzMWYyMzAz2AIG4AIB&ucfs=1&arphpl=1&checkin=2023-05-04&checkout=2023-05-08&group_adults=2&req_adults=2&no_rooms=1&group_children=0&req_children=0&hpos=13&hapos=13&sr_order=popularity&srpvid=1a939ebc2ac1007e&srepoch=1683153273&all_sr_blocks=5451616_91458335_2_34_0&highlighted_blocks=5451616_91458335_2_34_0&matching_block_id=5451616_91458335_2_34_0&sr_pri_blocks=5451616_91458335_2_34_0__75598&from_sustainable_property_sr=1&from=searchresults#hotelTmpl
Mont Saint Michel,LES APPARTEMENTS DE LA B,3,8.8,394,48.6179463,-1.848588,"6 Rue du Bord de Mer, 35114 Saint-Benoît-des-Ondes, France","The accommodation comes with a flat-screen TV and a private bathroom with bath or shower and a hairdryer, while the kitchen has a fridge, an oven and a dishwasher. A microwave, a stovetop and toaster are also offered, as well as a coffee machine and a kettle.",https://www.booking.com/hotel/fr/les-appartements-de-la-b.en-gb.html?aid=304142&label=gen173bo-1DCAQoggJCGHNlYXJjaF9tb250IHNhaW50IG1pY2hlbEgJWANoTYgBAZgBCbgBCsgBBdgBA-gBAfgBA4gCAZgCAqgCA7gCicPLogbAAgHSAiQwNmNmMTJiNC1jOTJiLTQ1YmYtODA5Yi04MTg1NWI4YzdkNGHYAgTgAgE&ucfs=1&arphpl=1&checkin=2023-05-04&checkout=2023-05-08&group_adults=2&req_adults=2&no_rooms=1&group_children=0&req_children=0&hpos=22&hapos=47&sr_order=popularity&srpvid=7f379ec4416901e7&srepoch=1683153290&all_sr_blocks=874928802_356332130_2_0_0&highlighted_blocks=874928802_356332130_2_0_0&matching_block_id=874928802_356332130_2_0_0&sr_pri_blocks=874928802_356332130_2_0_0__39440&from_sustainable_property_sr=1&from=searchresults#hotelTmpl
Mont Saint Michel,Les Madeleines,3,8.8,334,48.750355,-1.559052,"2 Rue Division Leclerc, 50740 Carolles, France","Each unit has an oven, microwave, a coffee machine, as well as a toaster and kettle. There is a private bathroom with shower and free toiletries in each unit, along with a hair dryer. Guests can relax in the seating area.",https://www.booking.com/hotel/fr/les-madeleines.en-gb.html?aid=304142&label=gen173nr-1FCAEoggI46AdIM1gEaE2IAQGYAQm4AQrIAQXYAQHoAQH4AQOIAgGoAgO4AsnCy6IGwAIB0gIkZjdhN2UwNzAtMDk0NC00MWE4LWI3MjQtZjYzZDAzMWYyMzAz2AIG4AIB&ucfs=1&arphpl=1&checkin=2023-05-04&checkout=2023-05-08&group_adults=2&req_adults=2&no_rooms=1&group_children=0&req_children=0&hpos=18&hapos=18&sr_order=popularity&srpvid=1a939ebc2ac1007e&srepoch=1683153273&all_sr_blocks=387104902_121712720_2_0_0&highlighted_blocks=387104902_121712720_2_0_0&matching_block_id=387104902_121712720_2_0_0&sr_pri_blocks=387104902_121712720_2_0_0__33440&from_sustainable_property_sr=1&from=searchresults#hotelTmpl
Mont Saint Michel,L'Etang,3,8.7,787,48.426766,-1.571864,"Lieu-dit L'Etang, 35560 Bazouges-la-Pérouse, France","Boasting garden views, L'Etang features accommodation with a balcony and a kettle, around 17.4 miles from Mont Saint Michel Abbey. This holiday home has a garden, barbecue facilities, free WiFi and free private parking.",https://www.booking.com/hotel/fr/l-39-etang-bazouges-la-perouse.en-gb.html?aid=304142&label=gen173bo-1DCAQoggJCGHNlYXJjaF9tb250IHNhaW50IG1pY2hlbEgJWANoTYgBAZgBCbgBCsgBBdgBA-gBAfgBA4gCAZgCAqgCA7gCicPLogbAAgHSAiQwNmNmMTJiNC1jOTJiLTQ1YmYtODA5Yi04MTg1NWI4YzdkNGHYAgTgAgE&ucfs=1&arphpl=1&checkin=2023-05-04&checkout=2023-05-08&group_adults=2&req_adults=2&no_rooms=1&group_children=0&req_children=0&hpos=19&hapos=44&sr_order=popularity&srpvid=7f379ec4416901e7&srepoch=1683153290&all_sr_blocks=252989601_337078037_7_0_0&highlighted_blocks=252989601_337078037_7_0_0&matching_block_id=252989601_337078037_7_0_0&sr_pri_blocks=252989601_337078037_7_0_0__78704&from=searchresults#hotelTmpl
Mont Saint Michel,Hotel Les Montois,2,8.6,347,48.6233373,-1.37032449,"19 Lieu dit Le Pommeray , 50220 Céaux, France","Hotel Les Montois offers 19 rooms adapted to your needs: cosy Standard Double Rooms, Superior Double Rooms with a double bed or two single beds, adapted Superior Double room with private access for people with reduced mobility, or Family rooms for 4 people.",https://www.booking.com/hotel/fr/le-pommeray.en-gb.html?aid=304142&label=gen173nr-1FCAEoggI46AdIM1gEaE2IAQGYAQm4AQrIAQXYAQHoAQH4AQOIAgGoAgO4AsnCy6IGwAIB0gIkZjdhN2UwNzAtMDk0NC00MWE4LWI3MjQtZjYzZDAzMWYyMzAz2AIG4AIB&ucfs=1&arphpl=1&checkin=2023-05-04&checkout=2023-05-08&group_adults=2&req_adults=2&no_rooms=1&group_children=0&req_children=0&hpos=9&hapos=9&sr_order=popularity&srpvid=1a939ebc2ac1007e&srepoch=1683153273&all_sr_blocks=24758009_91914644_2_2_0&highlighted_blocks=24758009_91914644_2_2_0&matching_block_id=24758009_91914644_2_2_0&sr_pri_blocks=24758009_91914644_2_2_0__34680&from_sustainable_property_sr=1&from=searchresults#hotelTmpl
Mont Saint Michel,Camping Les Couesnons,3,8.5,1004,48.594297,-1.5989672,"Route de Saint Malo, 35610 Roz-sur-Couesnon, France","With a private entrance, each mobile home includes a fully equipped kitchenette with coffee machine, microwave and fridge. There are also a dining area, a seating area with LCD TV and a private bathroom with shower.",https://www.booking.com/hotel/fr/camping-les-couesnons.en-gb.html?aid=304142&label=gen173nr-1FCAEoggI46AdIM1gEaE2IAQGYAQm4AQrIAQXYAQHoAQH4AQOIAgGoAgO4AsnCy6IGwAIB0gIkZjdhN2UwNzAtMDk0NC00MWE4LWI3MjQtZjYzZDAzMWYyMzAz2AIG4AIB&ucfs=1&arphpl=1&checkin=2023-05-04&checkout=2023-05-08&group_adults=2&req_adults=2&no_rooms=1&group_children=0&req_children=0&hpos=5&hapos=5&sr_order=popularity&srpvid=1a939ebc2ac1007e&srepoch=1683153273&all_sr_blocks=54449002_335522902_0_42_0&highlighted_blocks=54449002_335522902_0_42_0&matching_block_id=54449002_335522902_0_42_0&sr_pri_blocks=54449002_335522902_0_42_0__100368&from=searchresults#hotelTmpl
Mont Saint Michel,Kyriad Dol-de-Bretagne,3,8.5,486,48.55070557,-1.71970367,"Parc d'activité Les Rolandières 28 rue de la rouelle , 35120  Dol-de-Bretagne, France",The air-conditioned rooms at Kyriad Dol-de-Bretagne are decorated in a contemporary style and include free WiFi access and an LCD TV.,https://www.booking.com/hotel/fr/kyriad-dol-de-bretagn.en-gb.html?aid=304142&label=gen173bo-1DCAQoggJCGHNlYXJjaF9tb250IHNhaW50IG1pY2hlbEgJWANoTYgBAZgBCbgBCsgBBdgBA-gBAfgBA4gCAZgCAqgCA7gCicPLogbAAgHSAiQwNmNmMTJiNC1jOTJiLTQ1YmYtODA5Yi04MTg1NWI4YzdkNGHYAgTgAgE&ucfs=1&arphpl=1&checkin=2023-05-04&checkout=2023-05-08&group_adults=2&req_adults=2&no_rooms=1&group_children=0&req_children=0&hpos=2&hapos=27&sr_order=popularity&srpvid=7f379ec4416901e7&srepoch=1683153290&all_sr_blocks=40549109_348183191_2_2_0&highlighted_blocks=40549109_348183191_2_2_0&matching_block_id=40549109_348183191_2_2_0&sr_pri_blocks=40549109_348183191_2_2_0__48648&from_sustainable_property_sr=1&from=searchresults#hotelTmpl
Mont Saint Michel,Camping La Baie du Mont Saint Michel,2,8.5,342,48.626681,-1.388192,"1 La Mottaiserie, 50220 Céaux, France","Set in Céaux in the Lower Normandy region, Camping La Baie du Mont Saint Michel offers accommodation with free private parking.",https://www.booking.com/hotel/fr/mobil-home-4-47-6-personnes-ceaux.en-gb.html?aid=304142&label=gen173nr-1FCAEoggI46AdIM1gEaE2IAQGYAQm4AQrIAQXYAQHoAQH4AQOIAgGoAgO4AsnCy6IGwAIB0gIkZjdhN2UwNzAtMDk0NC00MWE4LWI3MjQtZjYzZDAzMWYyMzAz2AIG4AIB&ucfs=1&arphpl=1&checkin=2023-05-04&checkout=2023-05-08&group_adults=2&req_adults=2&no_rooms=1&group_children=0&req_children=0&hpos=7&hapos=7&sr_order=popularity&srpvid=1a939ebc2ac1007e&srepoch=1683153273&all_sr_blocks=632935504_247216216_4_0_0&highlighted_blocks=632935504_247216216_4_0_0&matching_block_id=632935504_247216216_4_0_0&sr_pri_blocks=632935504_247216216_4_0_0__34176&from=searchresults#hotelTmpl
Mont Saint Michel,Chambres d'hôtes Le Petit Angle,3,8.5,300,48.59446629,-1.66362159,"Le Petit angle, 35120 Saint-Broladre, France","The bed and breakfast is equipped with a TV. The kitchen has a fridge, an oven and a dishwasher and there is shower with free toiletries and a hairdryer.",https://www.booking.com/hotel/fr/chambres-d-39-hotes-le-petit-angle.en-gb.html?aid=304142&label=gen173nr-1FCAEoggI46AdIM1gEaE2IAQGYAQm4AQrIAQXYAQHoAQH4AQOIAgGoAgO4AsnCy6IGwAIB0gIkZjdhN2UwNzAtMDk0NC00MWE4LWI3MjQtZjYzZDAzMWYyMzAz2AIG4AIB&ucfs=1&arphpl=1&checkin=2023-05-04&checkout=2023-05-08&group_adults=2&req_adults=2&no_rooms=1&group_children=0&req_children=0&hpos=14&hapos=14&sr_order=popularity&srpvid=1a939ebc2ac1007e&srepoch=1683153273&all_sr_blocks=170977801_151432853_2_1_0&highlighted_blocks=170977801_151432853_2_1_0&matching_block_id=170977801_151432853_2_1_0&sr_pri_blocks=170977801_151432853_2_1_0__30000&from=searchresults#hotelTmpl
Mont Saint Michel,Hotel Rose,2,8.4,579,48.59706233,-1.51303947,"5 Route Du Mont Saint Michel, 50170 Beauvoir, France","Composed of thoughtfully designed independent bungalows and guestrooms in the annex house of a 19th-century building, Hotel Rose offers comfortable accommodation and a peaceful atmosphere.",https://www.booking.com/hotel/fr/gue-de-beauvoir.en-gb.html?aid=304142&label=gen173nr-1FCAEoggI46AdIM1gEaE2IAQGYAQm4AQrIAQXYAQHoAQH4AQOIAgGoAgO4AsnCy6IGwAIB0gIkZjdhN2UwNzAtMDk0NC00MWE4LWI3MjQtZjYzZDAzMWYyMzAz2AIG4AIB&ucfs=1&arphpl=1&checkin=2023-05-04&checkout=2023-05-08&group_adults=2&req_adults=2&no_rooms=1&group_children=0&req_children=0&hpos=2&hapos=2&sr_order=popularity&srpvid=1a939ebc2ac1007e&srepoch=1683153273&all_sr_blocks=5925504_369814916_2_2_0&highlighted_blocks=5925504_369814916_2_2_0&matching_block_id=5925504_369814916_2_2_0&sr_pri_blocks=5925504_369814916_2_2_0__57906&from_sustainable_property_sr=1&from=searchresults#hotelTmpl
Montauban,"Maison chaleureuse, quartier pavillonnaire",4,9.5,441,44.0112097,1.383876,"7 Rue René Descartes, 82000 Montauban, France","This air-conditioned holiday home has 2 bedrooms, a flat-screen TV, and a kitchen with a fridge and an oven. Towels and bed linen are offered in the holiday home.",https://www.booking.com/hotel/fr/maison-chaleureuse-quartier-pavillonnaire.en-gb.html?aid=304142&label=gen173bo-1DCAQoggJCEHNlYXJjaF9tb250YXViYW5ICVgDaE2IAQGYAQm4AQrIAQXYAQPoAQH4AQOIAgGYAgKoAgO4AorDy6IGwAIB0gIkZGQ4OTJmYmEtNDgyMy00ZWQ3LTllMjItMTJjMDZkOTg4ZmQw2AIE4AIB&ucfs=1&arphpl=1&checkin=2023-05-04&checkout=2023-05-08&group_adults=2&req_adults=2&no_rooms=1&group_children=0&req_children=0&hpos=5&hapos=30&sr_order=popularity&srpvid=32be9ec4442a00c8&srepoch=1683153291&all_sr_blocks=924709101_364274499_2_0_0&highlighted_blocks=924709101_364274499_2_0_0&matching_block_id=924709101_364274499_2_0_0&sr_pri_blocks=924709101_364274499_2_0_0__44112&from=searchresults#hotelTmpl
Montauban,"Le théâtre, cœur de ville",3,9.4,387,44.0188747,1.3537691,"4 Rue Mary Lafon, 82000 Montauban, France","The apartment comes with 2 bedrooms, a flat-screen TV and a fully equipped kitchen that provides guests with a fridge, an oven, a washing machine, a dishwasher and a microwave. Towels and bed linen are provided in the apartment.",https://www.booking.com/hotel/fr/le-theatre-coeur-de-ville.en-gb.html?aid=304142&label=gen173nr-1FCAEoggI46AdIM1gEaE2IAQGYAQm4AQrIAQXYAQHoAQH4AQOIAgGoAgO4AsnCy6IGwAIB0gIkZjdhN2UwNzAtMDk0NC00MWE4LWI3MjQtZjYzZDAzMWYyMzAz2AIG4AIB&ucfs=1&arphpl=1&checkin=2023-05-04&checkout=2023-05-08&group_adults=2&req_adults=2&no_rooms=1&group_children=0&req_children=0&hpos=6&hapos=6&sr_order=popularity&srpvid=92009ebb15f70113&srepoch=1683153273&all_sr_blocks=954197901_367946510_2_0_0&highlighted_blocks=954197901_367946510_2_0_0&matching_block_id=954197901_367946510_2_0_0&sr_pri_blocks=954197901_367946510_2_0_0__38724&from=searchresults#hotelTmpl
Montauban,Le Studio,1,9.4,241,44.02135469,1.35128807,"17 Rue du Docteur Alibert, 82000 Montauban, France","The apartment is fitted with 1 bedroom, a kitchen with fridge and oven, and 1 bathroom with a shower, a hairdryer and a washing machine. Towels and bed linen are offered in the apartment.",https://www.booking.com/hotel/fr/le-studio-montauban.en-gb.html?aid=304142&label=gen173nr-1FCAEoggI46AdIM1gEaE2IAQGYAQm4AQrIAQXYAQHoAQH4AQOIAgGoAgO4AsnCy6IGwAIB0gIkZjdhN2UwNzAtMDk0NC00MWE4LWI3MjQtZjYzZDAzMWYyMzAz2AIG4AIB&ucfs=1&arphpl=1&checkin=2023-05-04&checkout=2023-05-08&group_adults=2&req_adults=2&no_rooms=1&group_children=0&req_children=0&hpos=11&hapos=11&sr_order=popularity&srpvid=92009ebb15f70113&srepoch=1683153273&all_sr_blocks=853286201_360225033_2_0_0&highlighted_blocks=853286201_360225033_2_0_0&matching_block_id=853286201_360225033_2_0_0&sr_pri_blocks=853286201_360225033_2_0_0__24140&from=searchresults#hotelTmpl
Montauban,L'Escale des Libellules by BNB Conciergerie Mtban,3,9.1,384,44.01692547,1.3555235,"15 Rue Jules Michelet, 82000 Montauban, France","The 1-bedroom apartment has a living room with a TV, a fully equipped kitchen with fridge and microwave, and 1 bathroom with a hairdryer.",https://www.booking.com/hotel/fr/escale-des-libellules-by-bnb-conciergerie-mtban.en-gb.html?aid=304142&label=gen173bo-1DCAQoggJCEHNlYXJjaF9tb250YXViYW5ICVgDaE2IAQGYAQm4AQrIAQXYAQPoAQH4AQOIAgGYAgKoAgO4AorDy6IGwAIB0gIkZGQ4OTJmYmEtNDgyMy00ZWQ3LTllMjItMTJjMDZkOTg4ZmQw2AIE4AIB&ucfs=1&arphpl=1&checkin=2023-05-04&checkout=2023-05-08&group_adults=2&req_adults=2&no_rooms=1&group_children=0&req_children=0&hpos=4&hapos=29&sr_order=popularity&srpvid=32be9ec4442a00c8&srepoch=1683153291&all_sr_blocks=866711701_355117396_2_0_0&highlighted_blocks=866711701_355117396_2_0_0&matching_block_id=866711701_355117396_2_0_0&sr_pri_blocks=866711701_355117396_2_0_0__38351&from=searchresults#hotelTmpl
Montauban,Cosy Red 4 Pers - Neuf et au Calme - Fibre-Netflix,3,9.1,367,44.013431,1.3609724,"1er Etage Droit 30 Faubourg Lacapelle, 82000 Montauban, France","The apartment consists of 1 bedroom, a living room, a fully equipped kitchen with a fridge and a coffee machine, and 1 bathroom with a shower and a hairdryer. Towels and bed linen are featured in the apartment.",https://www.booking.com/hotel/fr/cosy-red.en-gb.html?aid=304142&label=gen173nr-1FCAEoggI46AdIM1gEaE2IAQGYAQm4AQrIAQXYAQHoAQH4AQOIAgGoAgO4AsnCy6IGwAIB0gIkZjdhN2UwNzAtMDk0NC00MWE4LWI3MjQtZjYzZDAzMWYyMzAz2AIG4AIB&ucfs=1&arphpl=1&checkin=2023-05-04&checkout=2023-05-08&group_adults=2&req_adults=2&no_rooms=1&group_children=0&req_children=0&hpos=18&hapos=18&sr_order=popularity&srpvid=92009ebb15f70113&srepoch=1683153273&all_sr_blocks=710118001_295820555_2_0_0&highlighted_blocks=710118001_295820555_2_0_0&matching_block_id=710118001_295820555_2_0_0&sr_pri_blocks=710118001_295820555_2_0_0__36651&from=searchresults#hotelTmpl
Montauban,L'élégant - Appartement - Hyper centre - Proche parking,3,8.9,374,44.0178294,1.3543463,"10 Place nationale, 82000 Montauban, France","The 1-bedroom apartment is equipped with a living room with a flat-screen TV, a fully equipped kitchen with a fridge and oven, and 1 bathroom with bath or shower. Towels and bed linen are provided in the apartment.",https://www.booking.com/hotel/fr/elegant-appartement-hyper-centre-proche-parking.en-gb.html?aid=304142&label=gen173nr-1FCAEoggI46AdIM1gEaE2IAQGYAQm4AQrIAQXYAQHoAQH4AQOIAgGoAgO4AsnCy6IGwAIB0gIkZjdhN2UwNzAtMDk0NC00MWE4LWI3MjQtZjYzZDAzMWYyMzAz2AIG4AIB&ucfs=1&arphpl=1&checkin=2023-05-04&checkout=2023-05-08&group_adults=2&req_adults=2&no_rooms=1&group_children=0&req_children=0&hpos=17&hapos=17&sr_order=popularity&srpvid=92009ebb15f70113&srepoch=1683153273&all_sr_blocks=831926401_352832201_2_0_0&highlighted_blocks=831926401_352832201_2_0_0&matching_block_id=831926401_352832201_2_0_0&sr_pri_blocks=831926401_352832201_2_0_0__37441&from=searchresults#hotelTmpl
Montauban,Jean-Antoine Mondésir,3,8.9,286,44.02095541,1.35614656,"16 Rue Mondesir, 82000 Montauban, France","The units come with parquet floors and feature a fully equipped kitchen with a fridge, a dining area, a flat-screen TV, and a private bathroom with shower and a hairdryer. A microwave, a stovetop and toaster are also available, as well as a coffee machine and a kettle.",https://www.booking.com/hotel/fr/joli-duplex-atypique-chic-et-contemporain.en-gb.html?aid=304142&label=gen173nr-1FCAEoggI46AdIM1gEaE2IAQGYAQm4AQrIAQXYAQHoAQH4AQOIAgGoAgO4AsnCy6IGwAIB0gIkZjdhN2UwNzAtMDk0NC00MWE4LWI3MjQtZjYzZDAzMWYyMzAz2AIG4AIB&ucfs=1&arphpl=1&checkin=2023-05-04&checkout=2023-05-08&group_adults=2&req_adults=2&no_rooms=1&group_children=0&req_children=0&hpos=16&hapos=16&sr_order=popularity&srpvid=92009ebb15f70113&srepoch=1683153273&all_sr_blocks=888854102_358848847_2_0_0&highlighted_blocks=888854102_358848847_2_0_0&matching_block_id=888854102_358848847_2_0_0&sr_pri_blocks=888854102_358848847_2_0_0__28591&from=searchresults#hotelTmpl
Montauban,Sure Hotel by Best Western Les Portes de Montauban,3,8.7,266,43.93628721,1.32209783,"175-225 Impasse De Fontanilles, 82710 Montauban, France","The hotel will provide guests with air-conditioned rooms offering a desk, a coffee machine, a safety deposit box, a flat-screen TV and a private bathroom with a shower. All guest rooms will provide guests with a wardrobe and a kettle.",https://www.booking.com/hotel/fr/sure-by-best-western-les-portes-de-montauban.en-gb.html?aid=304142&label=gen173nr-1FCAEoggI46AdIM1gEaE2IAQGYAQm4AQrIAQXYAQHoAQH4AQOIAgGoAgO4AsnCy6IGwAIB0gIkZjdhN2UwNzAtMDk0NC00MWE4LWI3MjQtZjYzZDAzMWYyMzAz2AIG4AIB&ucfs=1&arphpl=1&checkin=2023-05-04&checkout=2023-05-08&group_adults=2&req_adults=2&no_rooms=1&group_children=0&req_children=0&hpos=1&hapos=1&sr_order=popularity&srpvid=92009ebb15f70113&srepoch=1683153273&all_sr_blocks=739400502_366530990_2_42_0&highlighted_blocks=739400502_366530990_2_42_0&matching_block_id=739400502_366530990_2_42_0&sr_pri_blocks=739400502_366530990_2_42_0__26640&from_sustainable_property_sr=1&from=searchresults#hotelTmpl
Montauban,Le Fort de Montauban,3,8.6,477,44.0197306,1.3574099,"4 Rue du Fort, 82000 Montauban, France",Le Fort de Montauban is situated in Montauban. Complimentary WiFi is provided throughout the property.,https://www.booking.com/hotel/fr/le-fort-de-montauban.en-gb.html?aid=304142&label=gen173bo-1DCAQoggJCEHNlYXJjaF9tb250YXViYW5ICVgDaE2IAQGYAQm4AQrIAQXYAQPoAQH4AQOIAgGYAgKoAgO4AorDy6IGwAIB0gIkZGQ4OTJmYmEtNDgyMy00ZWQ3LTllMjItMTJjMDZkOTg4ZmQw2AIE4AIB&ucfs=1&arphpl=1&checkin=2023-05-04&checkout=2023-05-08&group_adults=2&req_adults=2&no_rooms=1&group_children=0&req_children=0&hpos=1&hapos=26&sr_order=popularity&srpvid=32be9ec4442a00c8&srepoch=1683153291&all_sr_blocks=948582701_367494351_3_0_0&highlighted_blocks=948582701_367494351_3_0_0&matching_block_id=948582701_367494351_3_0_0&sr_pri_blocks=948582701_367494351_3_0_0__47673&from=searchresults#hotelTmpl
Montauban,Immeuble hyper centre,3,8.5,371,44.01703937,1.35448361,"7 Rue du Greffe, 82000 Montauban, France","With city views, Immeuble hyper centre is located in Montauban and has free WiFi.",https://www.booking.com/hotel/fr/authentic-night-montauban.en-gb.html?aid=304142&label=gen173nr-1FCAEoggI46AdIM1gEaE2IAQGYAQm4AQrIAQXYAQHoAQH4AQOIAgGoAgO4AsnCy6IGwAIB0gIkZjdhN2UwNzAtMDk0NC00MWE4LWI3MjQtZjYzZDAzMWYyMzAz2AIG4AIB&ucfs=1&arphpl=1&checkin=2023-05-04&checkout=2023-05-08&group_adults=2&req_adults=2&no_rooms=1&group_children=0&req_children=0&hpos=20&hapos=20&sr_order=popularity&srpvid=92009ebb15f70113&srepoch=1683153273&all_sr_blocks=547675702_372004200_4_0_0&highlighted_blocks=547675702_372004200_4_0_0&matching_block_id=547675702_372004200_4_0_0&sr_pri_blocks=547675702_372004200_4_0_0__37087&from=searchresults#hotelTmpl
Montauban,Abbaye des Capucins Spa & Resort,4,8.2,496,44.02054293,1.34956688,"6-8 Quai De Verdun, 82000 Montauban, France","Abbaye des Capucins Spa & Resort offers soundproofed accommodation with air conditioning. Each guest room has a private bathroom and some have a terrace viewing the River Tarn. At an extra cost, guests can have breakfast in the comfort of their rooms.",https://www.booking.com/hotel/fr/abbaye-des-capucins-spa-and-resort.en-gb.html?aid=304142&label=gen173nr-1FCAEoggI46AdIM1gEaE2IAQGYAQm4AQrIAQXYAQHoAQH4AQOIAgGoAgO4AsnCy6IGwAIB0gIkZjdhN2UwNzAtMDk0NC00MWE4LWI3MjQtZjYzZDAzMWYyMzAz2AIG4AIB&ucfs=1&arphpl=1&checkin=2023-05-04&checkout=2023-05-08&group_adults=2&req_adults=2&no_rooms=1&group_children=0&req_children=0&hpos=13&hapos=13&sr_order=popularity&srpvid=92009ebb15f70113&srepoch=1683153273&all_sr_blocks=2776018_243333949_2_2_0&highlighted_blocks=2776018_243333949_2_2_0&matching_block_id=2776018_243333949_2_2_0&sr_pri_blocks=2776018_243333949_2_2_0__49640&from_sustainable_property_sr=1&from=searchresults#hotelTmpl
Montauban,Suite privée avec piscine,3,8.0,316,44.04776511,1.35040889,"971 Chemin de Traverse, 82000 Montauban, France","This air-conditioned apartment is fitted with 1 bedroom, a flat-screen TV, a dining area, and a kitchen with a fridge and a microwave. Towels and bed linen are offered in the apartment.",https://www.booking.com/hotel/fr/suite-privee-avec-piscine.en-gb.html?aid=304142&label=gen173nr-1FCAEoggI46AdIM1gEaE2IAQGYAQm4AQrIAQXYAQHoAQH4AQOIAgGoAgO4AsnCy6IGwAIB0gIkZjdhN2UwNzAtMDk0NC00MWE4LWI3MjQtZjYzZDAzMWYyMzAz2AIG4AIB&ucfs=1&arphpl=1&checkin=2023-05-04&checkout=2023-05-08&group_adults=2&req_adults=2&no_rooms=1&group_children=0&req_children=0&hpos=22&hapos=22&sr_order=popularity&srpvid=92009ebb15f70113&srepoch=1683153273&all_sr_blocks=841352701_350851819_2_0_0&highlighted_blocks=841352701_350851819_2_0_0&matching_block_id=841352701_350851819_2_0_0&sr_pri_blocks=841352701_350851819_2_0_0__31600&from=searchresults#hotelTmpl
Montauban,ibis Montauban,3,7.9,370,44.0053675,1.3837342,"50 route de Saint Martial, 82000 Montauban, France","Rooms have a simple decor and include an LCD TV, a telephone and a work desk. The private bathroom is fitted with a shower or a bathtub.",https://www.booking.com/hotel/fr/ha-tel-ibis-montauban.en-gb.html?aid=304142&label=gen173nr-1FCAEoggI46AdIM1gEaE2IAQGYAQm4AQrIAQXYAQHoAQH4AQOIAgGoAgO4AsnCy6IGwAIB0gIkZjdhN2UwNzAtMDk0NC00MWE4LWI3MjQtZjYzZDAzMWYyMzAz2AIG4AIB&ucfs=1&arphpl=1&checkin=2023-05-04&checkout=2023-05-08&group_adults=2&req_adults=2&no_rooms=1&group_children=0&req_children=0&hpos=15&hapos=15&sr_order=popularity&srpvid=92009ebb15f70113&srepoch=1683153273&all_sr_blocks=40904603_246035724_2_34_0&highlighted_blocks=40904603_246035724_2_34_0&matching_block_id=40904603_246035724_2_34_0&sr_pri_blocks=40904603_246035724_2_34_0__37020&from_sustainable_property_sr=1&from=searchresults#hotelTmpl
Montauban,Chez Ingres - Le Nid - Joyau caché en centre ville,3,7.7,308,44.0158138,1.3533855,"26 Rue des Carmes, 82000 Montauban, France","The apartment is composed of 1 separate bedroom, a fully equipped kitchenette with a fridge and a microwave, and 1 bathroom. Towels and bed linen are featured in the apartment.",https://www.booking.com/hotel/fr/le-nid-joyau-cache-en-hyper-centre.en-gb.html?aid=304142&label=gen173nr-1FCAEoggI46AdIM1gEaE2IAQGYAQm4AQrIAQXYAQHoAQH4AQOIAgGoAgO4AsnCy6IGwAIB0gIkZjdhN2UwNzAtMDk0NC00MWE4LWI3MjQtZjYzZDAzMWYyMzAz2AIG4AIB&ucfs=1&arphpl=1&checkin=2023-05-04&checkout=2023-05-08&group_adults=2&req_adults=2&no_rooms=1&group_children=0&req_children=0&hpos=23&hapos=23&sr_order=popularity&srpvid=92009ebb15f70113&srepoch=1683153273&all_sr_blocks=834517401_348809584_2_0_0&highlighted_blocks=834517401_348809584_2_0_0&matching_block_id=834517401_348809584_2_0_0&sr_pri_blocks=834517401_348809584_2_0_0__30824&from=searchresults#hotelTmpl
Montauban,B&B HOTEL Montauban,2,7.7,281,44.04011965,1.3860239,"600 Route du Nord, 82000 Montauban, France","The air-conditioned guest rooms have a flat screen TV,  All rooms include a private bathroom with a shower and free toiletries.",https://www.booking.com/hotel/fr/b-amp-b-montauban.en-gb.html?aid=304142&label=gen173nr-1FCAEoggI46AdIM1gEaE2IAQGYAQm4AQrIAQXYAQHoAQH4AQOIAgGoAgO4AsnCy6IGwAIB0gIkZjdhN2UwNzAtMDk0NC00MWE4LWI3MjQtZjYzZDAzMWYyMzAz2AIG4AIB&ucfs=1&arphpl=1&checkin=2023-05-04&checkout=2023-05-08&group_adults=2&req_adults=2&no_rooms=1&group_children=0&req_children=0&hpos=8&hapos=8&sr_order=popularity&srpvid=92009ebb15f70113&srepoch=1683153273&all_sr_blocks=136562501_158557454_0_0_0&highlighted_blocks=136562501_158557454_0_0_0&matching_block_id=136562501_158557454_0_0_0&sr_pri_blocks=136562501_158557454_0_0_0__28100&from=searchresults#hotelTmpl
